title,thumbnail,linkUrl,pcLinkUrl,mobileLinkUrl,officeName,rank,hitCount,updatedAt,createdAt,content
"DRX, LSB와의 뱅크더비 2차전서도 이벤트 선보인다",https://imgnews.pstatic.net/image/origin/236/2022/07/29/226097.jpg,https://n.news.naver.com/mnews/article/236/0000226097?sid=10779a79b,https://sports.news.naver.com/news.nhn?oid=236&aid=0000226097,https://n.news.naver.com/sports/esports/article/236/0000226097,포모스,31,0,2022-07-29T07:30:01,2022-07-29T07:30:01,"DRX가 다시 돌아온 뱅크더비를 맞아 팬들을 위해 특별한 이벤트를 준비했다. 디알엑스(DRX)가 오는 30일 ‘리그 오브 레전드 챔피언스 코리아’(LCK) 서머 스플릿 7주 차에 두 번째로 맞붙는 리브 샌드박스 경기에서 한층 강력해진 이벤트를 선보인다. 신한은행은 더욱 친근한 MZ세대와의 소통을 위해 이스포츠와 협업에 적극적으로 나서고 있다. 특히 DRX와 메인 스폰서십을 체결한 후 리브 샌드박스의 후원사인 국민은행과 라이벌 구도를 형성하며 이스포츠를 즐기는 팬들에게 더욱 특별한 경험을 선사하고 있다. 지난 6월 29일 처음으로 성사된 뱅크더비에서는 리브 샌드박스가 DRX를 상대로 승리를 거뒀다. 이에 DRX는 2라운드에서 다시 맞붙게 된 리브 샌드박스 경기를 응원하러 오는 팬들에게 더욱 풍성해진 이벤트를 진행한다. 먼저 경기 당일 DRX 유니폼 혹은 점퍼를 착용하거나 DRX 응원석 및 중립석에서 응원하는 팬 전원에게 뱅크더비 응원 키트를 증정한다. 응원 키트에는 뱅크더비를 위해 별도 제작된 종이가방, 슬로건, 알파카 부채, 야광 팔찌 등이 포함돼 있다. 더불어 DRX 경기 결과에 따라 마이신한포인트가 적립되는 ‘DRX 챔피언스 포인트 이벤트’ 5만명 달성 기념으로 감사 이벤트도 진행한다. 추첨 결과에 따라 선수 친필 게이밍기어, 친필 사인 포스터, DRX 아크릴 스탠드, DRX 메탈릭 스티커 세트 등을 증정한다. 또한 팬들에게 큰 인기를 끌었던 쏠인형을 선착순 100개한정판으로 지급한다. 뿐만 아니라 선수들에게 전달될 뱅크더비 응원 메시지 이벤트도 준비되어 있다. DRX 응원 부스에 비치된 메시지 보드에 응원 메시지를 적으면 선수들이 10명을 직접 선발해 2022 서머 시즌 유니폼을 지급한다. 신한은행 담당자는 “지난 뱅크더비에서 아쉬운 결과가 있었지만, 이스포츠와 은행권에 새로운 스토리를 만들 수 있어서 좋았다. 이번 경기도 팬분들이 재밌게 즐기실 수 있도록 DRX와 함께 많은 준비를 했다. 앞으로도 팬분들의 많은 응원과 관심 부탁드린다”고 전했다."
"'헤나 VS 테디 맞라인전'…브리온-광동, 선발 라인업 공개 [LCK]",https://imgnews.pstatic.net/image/origin/311/2022/07/29/1482374.jpg,https://n.news.naver.com/mnews/article/311/0001482374?sid=10779a79b,https://sports.news.naver.com/news.nhn?oid=311&aid=0001482374,https://n.news.naver.com/sports/esports/article/311/0001482374,엑스포츠뉴스,32,0,2022-07-29T06:52:01,2022-07-29T06:52:01,"(엑스포츠뉴스 김수정 기자) 브리온과 광동의 선발 라인업이 공개됐다. 29일 서울 종로구에 위치한 롤파크에서는 '2022 LCK 서머' 2라운드, 프레딧 브리온 대 광동 프릭스의 맞대결이 펼쳐진다. 현재 1승 11패로 3연패를 하고 있는 브리온과 4연패를 달리며 4승 8패를 기록 중인 광동의 만남. 둘 중 1승을 차지하고 연패를 끊을 팀은 어디가 될지 귀추가 주목되는 가운데, 양 팀 모두 최선의 선발 라인업을 준비했다. 먼저, 최근 날카로운 공격력을 보여주고 있는 브리온에서는 '모건' 박기태, '엄티' 엄성현, '라바' 김태훈, '헤나' 박증환, '딜라이트' 유환중이 출전한다. 마찬가지로 한층 물오른 경기력을 선보이고 있는 광동에서는 '기인' 김기인, '엘림' 최엘림, '페이트' 유수혁, '테디' 박진성, '호잇' 류호성이 나선다. 박증환과 박진성 중 원딜 캐리력을 폭발시키며 팀을 승리로 견인할 사람은 누가 될지 기대가 모인다. 사진=엑스포츠뉴스DB"
"[LCK] “과감한 진입과 위협적인 성장”, 자신의 아리 비결 밝힌 ‘쵸비’",https://imgnews.pstatic.net/image/origin/236/2022/07/29/226088.jpg,https://n.news.naver.com/mnews/article/236/0000226088?sid=10779a79b,https://sports.news.naver.com/news.nhn?oid=236&aid=0000226088,https://n.news.naver.com/sports/esports/article/236/0000226088,포모스,33,0,2022-07-29T06:01:01,2022-07-29T06:01:01,"“아리는 진입을 잘해야하는데 플레이할 때 그 각을 잘본다. 또 위협적일 정도로 성장을 잘해야 되지만 그에 맞춰 잘 성장할 수 있다"" 28일, 젠지가 압도적인 경기력을 뽐내며 DRX를 상대로 2대 0 승리를 가져갔다. 경기 후 기자실을 찾은 ‘쵸비’ 정지훈이 자신의 생각을 전했다. 승리 소감으로 “DRX를 상대로 2대 0 승리를 해 기분 좋다”고 말한 정지훈. 그는 “팀원들이 모두 잘해줬고 열심히했기 때문에 좋은 결과가 나왔다”며 완승의 비결을 밝혔다. 아리를 통해 전승을 기록하고 있는 비결을 묻자 정지훈은 “아리는 진입을 잘해야 하는데 플레이할 때 그각을 잘 본다고 생각한다. 또 위협적일 정도로 성장을 잘해야 하는데 그에 맞춰 성장을 잘할 수 있다”며 자신의 특별한 아리의 비결을 이야기했다. 젠지의 다음 상대는 디펜딩 챔피언 T1이다. 1라운드 젠지에게 유일하게 패배를 안기기도 했다. “평소에 잘하던 플레이들이 나오지 않았고 아쉬운 플레이를 했다. 자잘한 부분들로 인해 졌다고 생각한다”며 1라운드 패배를 분석한 정지훈. 그는 ‘피넛’ 한왕호그 T1전 패배 이후 밴픽 단계에서 더 많은 이야기를 한다고 한 것과 관련해 “밴픽 구도를 짤 때 많은 생각이 필요하다. 준비 시간을 길게 가지면 더 많은 상황에 대처할 수 있기 때문에 이런 말이 나오지 않았는지 생각한다”는 생각을 조심스럽게 이야기했다. 방송 인터뷰에서 T1전 승리 후 T1의 노래방에 가겠다고 한 부분과 관련해 그는 “도란에게 추천해준 것이지 내가 부르겠다고 한 것은 아니다. 하지만 기분이 좋으면 할 수도 있다. 이기고 생각해보겠다”며 팬들에게 하여금 기대의 여지를 남겼다. 마지막으로 그는 “좋은 결과 낼 수 있도록 열심히 노력하겠다. 팬들에게 항상 감사하다”는 감사 인사를 팬들에게 전하며 인터뷰를 마쳤다."
"DRX '쏭' 김상수 감독, 젠지전 패배 피드백…""갈 길이 멀다…준비도 미흡했다""",https://imgnews.pstatic.net/image/origin/311/2022/07/29/1482346.jpg,https://n.news.naver.com/mnews/article/311/0001482346?sid=10779a79b,https://sports.news.naver.com/news.nhn?oid=311&aid=0001482346,https://n.news.naver.com/sports/esports/article/311/0001482346,엑스포츠뉴스,34,0,2022-07-29T05:48:01,2022-07-29T05:48:01,"(엑스포츠뉴스 최지영기자) DRX의 '쏭' 김상수 감독이 젠지전 패배 피드백을 진행했다. 지난 28일 DRX는 '2022 LCK 서머' 2라운드 젠지와의 맞대결을 펼쳤다. 이날 DRX은 아쉽게 0대 2 패배를 당하며 6위에 랭크됐다. 이에 김상수 감독은 ""우선 좋은 경기력을 보여주지 못한 것을 가장 아쉽게 생각하고 있다""고 입을 열였다. 그는 ""갈 길이 멀다고 생각한다. 젠지전을 통해서 게임적인 부분과 밴픽적인 부분 피드백을 잘 해서 좋은 경기력을 보여드릴 수 있도록 더 많이 노력해야겠다고 생각한다""고 강조했다. 아울러 ""경기 준비 또한 미흡했다. 내가 앞으로 팀을 잘 이끌어서 단점을 개선하고 장점을 부각시켜 승리할 수 있도록 최선을 다하겠다""고 다짐했다. 사진=DRX"
중앙노동위원위도 김정수 감독 손 들어줘...디알엑스는 여전히 '불복',https://imgnews.pstatic.net/image/origin/109/2022/07/29/4667942.jpg,https://n.news.naver.com/mnews/article/109/0004667942?sid=10779a79b,https://sports.news.naver.com/news.nhn?oid=109&aid=0004667942,https://n.news.naver.com/sports/esports/article/109/0004667942,OSEN,35,0,2022-07-29T05:39:03,2022-07-29T05:39:03,"[OSEN=고용준 기자] 상급 기관의 결론도 결국 부당해고였다. 중앙노동위원회가 김정수 감독과 관련한 디알엑스의 부당해고 재심 구제신청을 기각했다.  중앙노동위원회는 지난 19일 디알엑스주식회사가 제기한 부당해고 재심 청구를 기각했다. 즉 지난 4월 서울지방노동위원회가 판정한대로 김정수 감독을 복직시키고, 미지급한 임금을 지급하라는 판정을 내렸다. 디알엑스는 지난 2월 4일 시즌 개막 5경기만에 김정수 감독을 전격 경질하였으나, 김 감독 측은 회사가 허락한다면 관련 사실을 모두 공개하고 싶다고 밝히며 법적 대응을 예고, 논란에 휩싸인 바 있다.  지난 4월 서울지방노동위원회가 디알엑스의 김정수 감독 부당해고를 인정함과 동시에 원직 복귀 판정을 내렸지만, 이에 불복한 디알엑스는 지난 5월 29일 법률대리인 법률사무소 새로를 내세워 입장을 밝혔고, 중앙노동위원회에 재심을 청구했다.  하지만 달라진 건 없었다. 중앙노동위원회는 다시 한 번 김정수 감독의 손을 들어주면서 부당해고라는 판정을 내렸다.  이번 중앙노동위원회의 판정에 대한 OSEN의 문의에 디알엑스의 법률대리인은 지난 5월 29일 발표한 입장문 외 추가적인 의견이나 내용은 전달하지 않았다. 디알엑스 법률대리인 새로는 앞서 '통상적으로 중앙노동위원회는 지방노동위원회와 결을 같이 하는 결정을 내리기 때문에 정당한 판결을 받기 위해서는 행정소송을 진행하겠다'라는 입장을 밝힌 있다.  새로측은 ""서울지방노동위원회의 결정문을 전달받고, 중앙노동위원회에 재심을 청구할 수 있는 기간 10일, 중앙노동위원회의 심리 기간 2~4개월, 중앙노동위원회의 결정에 대해서 소송을 제기할 수 있는 기간 15일, 이후 1심 행정소송 기간 3~9개월 정도를 고려하면 1심 결론을 얻는데 1년 이상의 기간이 소요될 수 있고, 2심 혹은 3심까지 진행을 한다면 3~5년이 걸릴 수 있다""며 법정 다툼을 예고했다.  김정수 감독의 에이전트인 쉐도우코퍼레이션 박재석 대표는 ""정말 중요한 한 고비를 넘겼다는 생각과 준비 과정이 정말 쉽지 않다는 생각이 들었다. 변호사님들과 김정수 감독에게 고생했다는 말을 전하고 싶고 , 서로가 원만하게 합의하기를 바란다는 생각을 디알엑스측에 전달 하고 싶다""고 입장을 밝혔다. / scrapper@osen.co.kr"
"'쵸비' 정지훈, T1전? ""경기 결과로 보면 돼…노래는 기분 좋으면 부를 수도"" [인터뷰]",https://imgnews.pstatic.net/image/origin/311/2022/07/29/1482342.jpg,https://n.news.naver.com/mnews/article/311/0001482342?sid=10779a79b,https://sports.news.naver.com/news.nhn?oid=311&aid=0001482342,https://n.news.naver.com/sports/esports/article/311/0001482342,엑스포츠뉴스,36,0,2022-07-29T05:31:01,2022-07-29T05:31:01,"(엑스포츠뉴스 김수정 기자) '쵸비' 정지훈이 T1전 승리에 강한 열의를 보였다. 지난 28일 서울 종로구에 위치한 롤파크에서는 '2022 LCK 서머' 2라운드, 젠지 대 DRX의 맞대결이 펼쳐졌다. 이날 1, 2세트 모두 좋은 흐름을 이어가며 2 대 0 완승을 거둔 젠지는 12승 1패, 세트 득실 +22를 기록하며 T1을 밀어내고 1위를 탈환하는 데 성공했다. 경기가 끝난 후 진행된 기자 공동 인터뷰에서 정지훈은 ""DRX 상대로 2 대 0 승리를 하고 연승을 이어가서 기분이 좋다""라고 밝혔다. 팀원들이 잘해준 덕분에 승리할 수 있었다고 말한 정지훈은 상대팀이었던 DRX에 대해 ""'제카' 선수가 잘하는 것 같아서 '제카' 선수 위주로 신경을 썼다. 미드 라인전에서 생각한 구도를 벗어나지 않아서 게임이 쉽게 흘러갔다""라고 설명했다. 정지훈은 앞서 라이엇 공식 인터뷰에서 'T1전 패인을 알고 있다'고 고백했다. 이에 관해 그는 ""평소에 잘하던 플레이들이 안 나왔고 아쉬운 플레이를 선택했다. 그런 자잘한 부분들 때문에 졌다고 생각하기 때문에 왜 졌는지 안다고 말했다. 경기 결과로 보면 될 것 같다""라며 자신감 있는 태도를 보였다. '도란' 최현준에게 T1전 승리 공약으로 '노래 부르기'를 추천한 정지훈은 ""내가 부르겠다고 한 게 아니라 도란 선수에게 추천한 것""이라고 강조하면서도 ""이기고 나서 생각해 보겠다. 기분이 좋으면 할 수도 있을 것 같다""라며 여지를 남겼다. 다음은 정지훈과의 인터뷰 전문이다. > 오늘 승리를 거뒀는데 소감이 어떤가? DRX 상대로 2 대 0 승리를 하고 연승을 이어가서 기분이 좋다. > 완승을 거둔 이유가 뭐라고 생각하는지? 팀원들이 다 잘해줬고 열심히 했기 때문에 좋은 결과가 나왔고 이길 수 있었다. > DRX를 어떻게 평가했고, 어떤 점을 주의하면서 경기를 했나? '제카' 선수가 잘하는 것 같아서 '제카' 선수 위주로 신경을 썼다. 미드 라인전에서 생각한 구도를 벗어나지 않아서 게임이 쉽게 흘러갔다. > 미드에서 1, 2세트가 같은 구도였지만 다른 보조 룬을 선택했는데 이유가 무엇인지? 평소 아리로 지배를 선호하는데, 1세트 같은 경우 시비르가 있고 게임이 길어질 것 같아서 폭풍의 결집을 선택했고, 2세트는 게임이 빨리 끝날 것 같아 지배룬을 선택했다. > DRX전 각 세트의 승부처는 어디라고 생각하는지 궁금하다. 1세트는 전령을 바텀에서 풀고 첫 포탑을 가져갔을 때 유리하다고 생각했고, 2세트는 미드에서 스펠 교환과 킬 교환이 나온 후 아리, 바이 조합으로 유리하게 풀어갈 수 있다고 생각했다. > 아리 성적이 굉장히 좋다. 본인의 스타일과 어떤 점이 맞아서 좋은 성적이 나오는 것 같은지? 아리는 진입을 잘해야 하는데 플레이할 때 제가 그 각을 잘 본다고 생각한다. 또, 상대팀에게 위협적일 정도로 성장을 잘 해야 하는데 저는 그에 맞춰 성장을 잘할 수 있어서 좋다고 생각한다. > 사거리가 길고 포킹이 많은 상대로 밴시의 장막을 올렸다. 아리는 대치 구도에서 상대 스킬을 맞는 것보다 사이드 관리를 하고 돌아다니면서 이니시를 거는 게 좋다고 생각한다. 그런 상황일 때 조금 더 안정적이라서 밴시의 장막을 선택했다. 스킬을 하나 흘리거나 사이드에서 혹시라도 갱킹을 당했을 때 피 관리가 쉬워지기 때문에 좋은 것 같다. > 1라운드 T1전 이후로 어떤 피드백이 나왔는지? 평소에 잘하던 플레이들이 안 나왔고 아쉬운 플레이를 선택했다. 그런 자잘한 부분들 때문에 졌다고 생각하기 때문에 왜 졌는지 안다고 말했다. 경기 결과로 보면 될 것 같다. > '피넛' 한왕호 선수가 T1전 패배 후에 밴픽에 대해 더 길게 얘기한다고 했는데 어떤 효과가 있는지 궁금하다. 밴픽 구도를 짤 때 많은 생각이 필요한데 준비 시간을 길게 가지면 더 많은 상황에 대처할 수 있기 때문에 그런 말이 나오지 않았나 생각한다. > 오늘 처음으로 12.13 패치 경기를 치렀는데 미드 라인 메타에 변화가 있다고 생각하는지? 미드는 딱히 변화가 없어서 위화감을 못 느꼈다. 큰 문제는 없을 것 같다. > 성장, 싸움은 압도적인데 킬 관여율은 낮다. 팀을 믿기 때문인가? 사이드에 있을 때 팀원들이 먼저 싸우고 킬을 낸다. 나도 싸우고 싶지만 기회가 없다. > T1전을 이기면 노래를 부르겠다고 했는데? 내가 부르겠다고 한 게 아니라 도란 선수에게 추천한 거다. 이기고 나서 생각해 보겠다. 기분이 좋으면 할 수도 있을 것 같다. > 마지막으로 하고 싶은 말이 있다면? 좋은 결과 낼 수 있도록 열심히 노력하겠다. 또, 팬분들에게 항상 감사하다고 전하고 싶다. 사진=엑스포츠뉴스DB"
"[LCK] 조합 이유 보여주지 못해 아쉬웠던 ‘고스트’ ""지더라도 할 건 해야돼”",https://imgnews.pstatic.net/image/origin/236/2022/07/29/226085.jpg,https://n.news.naver.com/mnews/article/236/0000226085?sid=10779a79b,https://sports.news.naver.com/news.nhn?oid=236&aid=0000226085,https://n.news.naver.com/sports/esports/article/236/0000226085,포모스,37,0,2022-07-29T04:31:01,2022-07-29T04:31:01,"""조합의 이유를 보여준 적이 거의 없다. 지더라도 할 건 하고 지고 싶다” 28일, 농심이 리브 샌박을 꺾고 8연패의 마침표를 찍었다. 경기 후 포모스와의 인터뷰에 응한 ‘고스트’ 장용준이 끝까지 자신들을 응원해준 팬들에게 감사한 마음을 전했다. 장용준은 팬들에게 감사한 마음을 가장 먼저 전했다. 그는 “너무 오랜만에 이겨서 기분 좋다. 경기가 끝나고 인사하러 가는데 한 팬분이 울고 계신 것을 봤다. 함께 울컥했다”는 상황을 설명했다. 이어 “경기를 하러 올 때마다 팬분들이 계속 와주셔서 감사드리지만 한편으로는 너무 죄송했다. 형편없는 경기력에도 끝까지 응원해주신 팬들을 보고 끝까지 포기하지 않아야겠다는 생각이 든다”고 이야기하며 노력의 원동력이 팬임을 밝혔다. “이길 수 있었던 경기도 있었고 허무하게 진 경기도 있었다. 게임 내 플레이와 자신감 등 정말 많은 문제들이 복합적으로 있었다”는 연패 이유를 밝힌 장용준. 그는 “싸움도 못하고 진 경기가 많았다. 조합의 이유를 보여준 적이 거의 없는 것 같았기 때문에 지더라도 할 건 하고 지고 싶었다”며 리브 샌박전에서 원하던 플레이를 보여줄 수 있어 만족스럽다는 입장을 전했다. 이어 “모든 경기에 최선을 다해 팬들에게 저희의 방향성을 보여드리기 위해 노력하고 있다”며 앞으로 더욱 확실해질 팀 컬러를 팬들에게 선보일 것임을 다짐했다. 마지막으로 장용준은 “8연패하는 동안 끝까지 응원해준 팬들에게 정말 감사하다. 앞으로 남은 경기도 최선을 다하도록 하겠다”는 감사 인사를 팬들에게 다시 전하며 인터뷰를 마쳤다."
"DK vs KT… 잡아먹을 것인가, 먹힐 것인가?",https://imgnews.pstatic.net/image/origin/417/2022/07/29/837676.jpg,https://n.news.naver.com/mnews/article/417/0000837676?sid=10779a79b,https://sports.news.naver.com/news.nhn?oid=417&aid=0000837676,https://n.news.naver.com/sports/esports/article/417/0000837676,머니S,38,0,2022-07-29T03:35:01,2022-07-29T03:33:00,"KT롤스터와 담원기아가 29일 저녁 리그오브레전드(LOL)의 한국 프로리그 LCK 서머 2라운드 경기를 치른다. 사진은 '에이밍' 김하람(KT). /사진=KT롤스터 인스타그램   KT롤스터는 담원기아를 극복할 수 있을까.  KT는 29일 저녁 담원과 리그오브레전드(LOL)의 한국 프로리그 LCK 서머 2라운드 경기를 치른다. 지난 1일 펼쳐진 1라운드 경기는 많은 사람들의 예상대로 담원이 KT에 2-0 완승을 거뒀다. 하지만 상황이 달라졌다. KT는 지난 27일 리그 선두 경쟁중인 T1을 상대로 1-2 석패했지만 좋은 승부를 펼쳤다. 팀의 승리 공식도 명확하다. 물오른 파괴력을 과시하는 '에이밍' 김하람에 자원을 몰아준다. 또 신예 '빅라' 이대광이 좋은 모습을 과시해 중단 힘싸움에서도 쉽게 밀리지 않는다. 담원은 올시즌 기대 이하의 성적에 머무르고 있다. 담원은 오프시즌 '너구리' 장하권을 영입해 리그 '빅3'를 구축했다는 평가를 받았다. 하지만 팀은 나란히 12승1패를 달리는 젠지 이스포츠와 T1에 비해 올시즌 9승4패로 뒤처진다. 약팀을 상대로는 무자비한 경기력을 보여주고 있지만 젠지·T1·DRX 등 강팀들을 상대로는 모두 패했다. 기세가 오른 KT는 이번 기회로 담원을 극복해야 한다. 담원은 강팀에게 약한 모습을, 상대적 약팀에게는 압도적인 모습을 보인다. KT의 경기력이 어설프다면 담원에게 잡아먹힐 것이다. 한편 담원도 승리가 간절하다. '플레이오프 진출 안정권'인 10승 고지를 밟기 위해 KT를 제압해야 한다."
