title,thumbnail,linkUrl,pcLinkUrl,mobileLinkUrl,officeName,rank,hitCount,updatedAt,createdAt,content
'너구리 게이밍 헤어' 너구리의 다음 도전은 삭발? 장발? (LCK) [SS영상],https://mimgnews.pstatic.net/image/origin/468/2022/07/29/869714.jpg,https://m.news.naver.com/read.nhn?oid=468&aid=0000869714,https://sports.news.naver.com/news.nhn?oid=468&aid=0000869714,https://n.news.naver.com/sports/esports/article/468/0000869714,스포츠서울,8,7857,2022-07-29T01:25:01,2022-07-29T01:24:16,"[스포츠서울 박경호 김지윤기자] 담원 기아가 한화생명e스포츠에 역전승을 거두며 3위를 수성했다. 담원은 27일 서울 종로구에 위치한 롤파크에서 진행된 '2022 리그 오브 레전드 챔피언스 코리아(LCK)' 서머 스플릿 2라운드 한화생명과 대결에서 2-1로 승리했다.  다음은 '너구리' 장하권과의 일문일답.  Q. 3위를 수성했다. 승리 소감은?  -이렇게 패로 시작하고 이긴 적이 처음이라서 다행이라고 생각하고 있고, 다행이라는 기분이 많이 드는 것 같습니다. Q. 1세트 피오라를 꺼내들었다. 오랜만에 '칼구리'를 보게 됐는데  -나르가 없는 상태에서 그웬을 상대로 뭘 할까 고민하다가 준비를 해온 픽이었고, 칼 부러져서 조금 아쉽긴 한데 그렇게 준비하게 됐습니다. Q. 1세트 두두와 탑 대 탑 명승부를 펼쳤다. 눈만 마주치면 싸우던데 상황 설명해 줄 수 있나 -아무래도 마지막이 제일 컸던 것 같은데, 제가 세 번째 잡았을 때는 그렇게 큰 의미는 없었던 것 같고 두 번째 네 번째 죽었을 때가 너무 커서 그게 가장 기억에 나는데, 두 번째는 서로 1코어 신화템이 나온 상황에서 죽어서 그때 타워랑 이런 거 손해 봤던 게 많이 아쉬웠던 것 같고 마지막이 제일 컸던 것 같은데 제가 그때 딜 계산을 잘 못 했던 거 같아요. 약점 세 번에는 안 죽더라고요.그전에 딜 계산으로 봤을 때는 충분히 다이브 가능하다 판단하고 해서 자신감 갖고 했는데 잘 안된게 너무 아쉬웠던 것 같습니다. Q. 1세트 아쉬운 패배, 어떤 피드백을 했는지 궁금하다  -그 판이 피오라가 그웬을 잡아놓기만 해도 본대가 되게 저희 미드라이너 조이가 힘이 세서 그걸 잘 이용했으면 좋았을 것 같은데, 제가 그런 부분을 신경 못 쓰고 1 대 1만 봤던 게 좀 아쉬웠고 그런 피드백 했었던 거 같아요.  Q. 2세트에서 사이온과 쉬바나 구도가 나왔다. 이 구도에 대해 어떻게 생각하는지  -서로 어떻게 보면 턴 나면 바텀이나 용을 그냥 뛰어버리는? 그런 매치라고 생각하고 거의 바텀 게임을 서로 하는 매치니까 그런 부분에서 디테일하게 바텀 쪽 포커싱 잘하는 팀이 유리한 구도라고 생각합니다. Q. 현재 사일러스가 고승률에 좋은 픽이라고 생각한다. 또 탑으로 픽할 가능성은?  -탑 사일러스는 대회에서 보면 나르 상대로 많이 쓰는 거 같고, 사일러스는 일단 상대 궁극기도 중요하지만 라인전 자체도 되게 힘든 상대 만나면 너무 힘들기 때문에 그런 구도를 잘 파악하는 게 중요하는 것 같습니다. 스왑이 되니까.  Q. 12.13패치에서 탑에 변경된 점이 있다면?  -시비르 등장이 가장 큰 것 같고, 이 시비르 등장으로 챔피언 티어? 이런 게 많이 바뀐 것 같고요. 그웬 바뀐 게 큰 것 같아요. 그웬이 전보다 난이도가 쉬워졌고 오히려 대회에서도 오늘 겪어보니까 더 좋을 수도 있겠다는 생각이 들고 이 두 가지 변화가 지금 느꼈을 때는 가장 기억에 좀 남는 것 같습니다. Q. 최근 담원 기아 유튜브에 쇼메이커와 칸이 면허를 따는 영상이 올라왔다. 올해 도전하고 싶은 게 있다면?  -저도 쉴 때 되면은 바로 면허를 딸 생각이고, 콘텐츠까지는 잘 소화할 수 없을 것 같아서 조용히 딸 것 같습니다.  Q. '너구리 게이밍 헤어'가 화제인데, 새로 도전해 보고 싶은 머리 스타일이 있을까  -저는 길게도 길러보고 싶고, 파마? 파마했을 때 느낌이 좀 괜찮았던 것 같아서 그거랑 염색하고 싶습니다. 이거는 정말 생각을 안 해봐 가지고 막연한 생각이어서 좀 밝은 색으로도 해보고 싶고 이거는 좀 봐야 알 것 같아요 지금은 상상이 안 가서. Q. 다음 경기는 kt다. 라스칼과 맞대결을 펼치는데 각오.  -kt는 거의 방향성을 다른 팀 대부분 다 그렇지만 바텀 중심으로 하는 게임이 이번 버전에서 되게 중요한 것 같은데, 서로 어떻게 보면 그런 부분에서 픽을 하는 것 같고 최근 대회에서.평소처럼 잘 준비해서 저희 플레이를 잘 다듬는 게 중요한 것 같습니다.  취재 | 김지윤기자 merry0619@sportsseoul.com  영상 | 박경호기자 park5544@sportsseoul.com"
"8연패 끊은 '칸나' 김창동 ""감정 벅차올라…시비르 잡을 때 화끈했다"" [LCK]",https://mimgnews.pstatic.net/image/origin/311/2022/07/28/1482006.jpg,https://m.news.naver.com/read.nhn?oid=311&aid=0001482006,https://sports.news.naver.com/news.nhn?oid=311&aid=0001482006,https://n.news.naver.com/sports/esports/article/311/0001482006,엑스포츠뉴스,9,7769,2022-07-28T16:28:01,2022-07-28T10:58:01,"(엑스포츠뉴스 김수정 기자) '칸나' 김창동이 승리 소감을 전했다. 28일 서울 종로구에 위치한 롤파크에서는 '2022 LCK 서머' 2라운드, 리브 샌드박스 대 농심 레드포스의 경기가 치러졌다. 이날 한타력을 폭발시킨 농심은 리브 샌박을 2-0으로 격파하며 8연패 사슬을 끊어내는 데 성공했다. 경기 후 진행된 라이엇 공식 인터뷰에서 김창동은 ""길었던 8연패를 끊고 이겨서 너무 기쁘다. 1세트 딸 때마다 감정이 벅차올라서 재밌었다""라고 말했다. 이진혁 역시 ""연패를 끊어서 기분 좋고, 오늘이 제일 기쁘다""라며 웃음을 보였다. 금일 완벽한 경기력을 뽐냈던 '드레드' 이진혁은 ""제가 스트레스에 약한 편인데 최대한 스트레스를 안 받으려고 했다""라고 밝혔다. 김창동은 1세트에서 시비르-유미를 주고 알리스타를 가져온 것에 대해 ""바텀 픽은 제 역할이 아니어서 잘 모르겠지만, 좋아서 한 것 같다. '눈꽃' 노회종 선수가 알리스타를 픽할 때 자신 있게 이야기해서 그런가 보다 했다""라고 설명했다. 12.13 패치에서 리워크된 그웬을 상대했던 김창동은 ""그웬 궁극기가 변하면서 초보자 분들이 쓰기 편해진 것 같고, 깡딜이 올라서 초반에 강한 모습을 보여준다""라고 전했다. 해당 세트에서 나르로 좋은 활약을 펼친 것에 대해서는 ""미드 2차 포탑에서 시비르를 잡을 때 화끈했다""라고 털어놨다. 7주 차에서 완전히 달라진 모습을 보여준 농심. 비결을 묻자 이진혁은 ""연습을 열심히 했던 것 같다. 저희가 안 좋은 상황에서도 으쌰으쌰하고 그랬던 게 큰 것 같다""라고 답했다. 3세트에서 스카너를 꺼낸 이진혁. 그는 ""상대 조합을 봤을 때 스카너 각이라고 생각했는데 코치, 감독님도 스카너 해 보라고 하셨다""라고 설명했다. 이진혁은 금일 적극적인 움직임을 보여주며 팀 승리에 이바지했다. 이에 관해 ""대체적으로 라인 주도권이 있다 보니까 상대 정글을 찾으면 편할 것 같다는 생각을 했다""라고 말했다. 농심의 다음 상대는 매서운 경기력을 보여주는 프레딧 브리온이다. 김창동은 ""브리온이 팀 자체가 한타를 잘해서 그 부분을 신경 써야 할 것 같다. 이겨보겠다""라는 각오를 다졌다. 이진혁은 ""브리온전 때 개인적인 이슈로 경기를 못 나갔는데 이번에는 출전해서 꼭 이기도록 하겠다""라고 다짐했다. 사진=엑스포츠뉴스DB"
"DRX '쏭' 김상수 감독, 젠지전 패배 피드백…""갈 길이 멀다…준비도 미흡했다""",https://mimgnews.pstatic.net/image/origin/311/2022/07/29/1482346.jpg,https://m.news.naver.com/read.nhn?oid=311&aid=0001482346,https://sports.news.naver.com/news.nhn?oid=311&aid=0001482346,https://n.news.naver.com/sports/esports/article/311/0001482346,엑스포츠뉴스,10,7748,2022-07-29T05:48:01,2022-07-29T05:48:01,"(엑스포츠뉴스 최지영기자) DRX의 '쏭' 김상수 감독이 젠지전 패배 피드백을 진행했다. 지난 28일 DRX는 '2022 LCK 서머' 2라운드 젠지와의 맞대결을 펼쳤다. 이날 DRX은 아쉽게 0대 2 패배를 당하며 6위에 랭크됐다. 이에 김상수 감독은 ""우선 좋은 경기력을 보여주지 못한 것을 가장 아쉽게 생각하고 있다""고 입을 열였다. 그는 ""갈 길이 멀다고 생각한다. 젠지전을 통해서 게임적인 부분과 밴픽적인 부분 피드백을 잘 해서 좋은 경기력을 보여드릴 수 있도록 더 많이 노력해야겠다고 생각한다""고 강조했다. 아울러 ""경기 준비 또한 미흡했다. 내가 앞으로 팀을 잘 이끌어서 단점을 개선하고 장점을 부각시켜 승리할 수 있도록 최선을 다하겠다""고 다짐했다. 사진=DRX"
"[LCK] PO 진출 희망의 끈 놓지 않은 농심 허영철 감독 “눈꽃, 확실하게 한타 열 수 있는 선수”",https://mimgnews.pstatic.net/image/origin/236/2022/07/29/226073.jpg,https://m.news.naver.com/read.nhn?oid=236&aid=0000226073,https://sports.news.naver.com/news.nhn?oid=236&aid=0000226073,https://n.news.naver.com/sports/esports/article/236/0000226073,포모스,11,6800,2022-07-28T15:01:01,2022-07-28T15:01:01,"“눈꽃은 확실하게 교전을 열 수 있는 선수다. 눈꽃의 적응과 함께 경기력도 함께 올라오고 있으며 플레이오프 진출을 위해 최대한 노력하겠다” 28일, 농심이 리브 샌박을 꺾고 8연패의 마침표를 찍었다. 기자실을 찾은 허영철 감독이 플레이오프 진출 여부와 상관없이 발전된 모습을 팬들에게 보여주겠다는 각오를 다졌다. 오랜만에 하는 승리라 더욱 뜻 깊었다는 허영철 감독. 그는 “기세를 한 번 타야 한다고 생각했다. 늦었지만 남은 경기도 잘할 수 있게 준비하겠다”며 선수들과 함께 앞으로 더욱 분발하겠다는 생각을 전했다. 연패 이유로는 적재적소의 상황에서 원하는 챔피언을 꺼내지 못한 것을 이유로 들었다. 허영철 감독은 “선수들의 챔피언 풀이 넓지 않았다”며 “저격 밴을 당하면 마땅히 할 수 있는 픽들이 많지 않았고 챔피언들을 연습하는 과정에서의 결과 또한 좋지 않았다”는 생각을 조심스럽게 밝혔다. 이어 “챔피언 풀이 늘어나고 연습이 잘되면서부터 괜찮은 경기력이 나온 것 같다”는 입장을 덧붙였다. 협곡에 다양한 챔피언들이 등장 가능하게 되며 챔피언 풀의 중요성은 더욱 높아졌다. 허영철 감독은 “상황에 맞춰 해야 하는 픽이 있지만 그게 한정적이라 자연스럽게 (선수들의 챔피언 풀이) 좁아보인 것 같다. 비디디 선수에 기대야 할 때가 많았고 그런 상황에서 할 수 있는 픽들이 많지 않았다”며 선수들의 챔피언 풀이 좁아지게 된 과정에 대해 함께 이야기했다. 시즌 중간 팀에 합류한 ‘눈꽃’ 노회종은 농심의 과감한 이니시에 힘을 보태기 위함이었다. 허영철 감독은 “한타가 중요한 메타라고 생각한다. 눈꽃은 한타를 확실하게 열 수 있는 선수라고 생각해 영입하게 됐다”며 선수 영입의 이유를 밝혔고, “연습 과정도 좋았지만 초반에 자신감이 없어서 결과가 잘 나오지 않았다. 어느 정도 적응이 되면서 각이 보이면 확실히 (교전을) 열려고 한다. 경기력도 함께 좋아지고 있다”며 농심의 경기력이 노회종의 적응과 함께 발전하고 있다고 이야기했다. 허영철 감독은 아직 플레이오프 진출의 희망을 놓지 않고 있다는 입장을 전했다. 그는 “원래 플레이오프 진출이 목표였다. 오늘 경기를 계기로 남은 경기도 과감하게 했으면 좋겠고 플레이오프 진출을 위해 최대한 노력하겠다”는 각오를 전한 뒤, “하지만 지금 당장은 우리가 할 수 있는 것을 최대한 하도록 하겠다. 최선을 다해 시즌을 잘 마무리하는 것을 목표로 하고 있다”며 팀의 컬러를 찾기 위해 노력하겠다는 각오를 다졌다. 마지막으로 그는 “서머 때는 좋은 모습을 보여드리려고 노력했다. 결과가 나오지 못해 죄송한 마음이고 플레이오프 진출여부와 상관 없이 더 좋아진 경기력으로 보답하겠다”는 메시지를 팬들에게 전하며 인터뷰를 마쳤다."
"[LCK] '쵸비' 정지훈 ""T1, 충분히 이길 수 있어""",https://mimgnews.pstatic.net/image/origin/347/2022/07/29/165040.jpg,https://m.news.naver.com/read.nhn?oid=347&aid=0000165040,https://sports.news.naver.com/news.nhn?oid=347&aid=0000165040,https://n.news.naver.com/sports/esports/article/347/0000165040,데일리e스포츠,12,6773,2022-07-28T23:01:01,2022-07-28T23:01:01,"팀의 6연승을 이끈 젠지e스포츠의 '쵸비' 정지훈이 다가올 T1전에 대한 생각을 밝혔다.  젠지는 28일 서울 종로구 그랑서울 LCK아레나에서 열린 2022 리그 오브 레전드 챔피언스 코리아 서머 2라운드에서 디알엑스를 2대0으로 제압하고 6연승을 질주했다. 정지훈은 1, 2세트 모두 아리로 맹활약하며 팀의 승리를 도왔다.  경기 후 인터뷰에서 정지훈은 30일에 있을 T1전에 자신감을 가지고 있는지에 대한 질문에 ""사실 자신감이라기보다는 그냥 해보는 것이다""라며 경계의 자세를 취했다. 그러면서도 ""그냥 해보는 것이지만 충분히 이길 수 있다고 생각하고 있다""고 덧붙였다.  젠지는 지난 1라운드에서 T1에게 1대2 역전패를 당했다. 정지훈은 당시 패인을 분석하면서 여러 가지 부분에서 문제를 발견했음을 이야기했다. 그는 ""평소에 잘하던 플레이들이 잘 안 나왔고 아쉬운 플레이가 나왔다. 밴픽적인 부분에서도 의견이 갈렸다""며 ""그런 자잘한 부분들로 인해 패했다고 생각하고 이제는 이유를 알고 있으니까 이번에 붙어서 경기 결과로 확인하면 될 것 같다""고 설명했다.  젠지는 디알엑스를 상대로 매치 6연승을 달리기도 했다. 정지훈은 준비 과정에서 '제카' 김건우를 신경 썼다고 이야기했다. ""제가 생각했을 때 요즘 '제카' 김건우가 잘하는 것 같다""고 말을 시작한 정지훈은 ""그래서 김건우 위주로 경기를 생각했고 오늘 미드 라인전의 경우 제가 생각한 구도에서 크게 벗어나지 않아 게임이 쉽게 흘러갈 수 있었다""고 이야기했다.  정지훈은 이날 경기에서 두 번 모두 아리를 꺼내 들어 활약했다. 이날 경기를 포함 최근 아리로 좋은 승률을 기록하고 있는 부분에 대해서는 ""아리를 플레이할 때는 궁극기로 진입각을 잘 봐야 하는데 제가 요즘 그 부분을 잘한다고 생각한다""며 ""그리고 진입해서 위협적일 만큼 성장을 잘해야 하는데 성장 부분에서도 잘하고 있다고 생각해서 승률이 잘 나오는 것 같다""고 말하며 좋은 승률에 대한 원인을 분석하기도 했다.  12.13 패치에 대한 질문에는 ""미드에는 딱히 변화가 없다고 생각한다""며 ""그래서 오늘 경기에서도 위화감을 느끼지 못했고 앞으로도 큰 문제는 없을 것 같다""며 자신의 생각을 밝히기도 했다.  마지막으로 정지훈은 ""서머 2라운드 치르고 있는데 끝에 가서 좋은 결과 낼 수 있도록 열심히 노력하겠다""며 ""팬들에게 항상 감사하다는 말을 전하고 싶다""고 이야기하며 인터뷰를 마무리했다."
"유럽 언론, ‘롤드컵 2회 우승’ 듀크 재조명",https://mimgnews.pstatic.net/image/origin/410/2022/07/28/884728.jpg,https://m.news.naver.com/read.nhn?oid=410&aid=0000884728,https://sports.news.naver.com/news.nhn?oid=410&aid=0000884728,https://n.news.naver.com/sports/esports/article/410/0000884728,MK스포츠 ,13,6618,2022-07-28T04:01:01,2022-07-28T04:01:01,"듀크(본명 이호성·28)가 3년 전 은퇴했음에도 ‘서로 다른 게임단에서 리그오브레전드 월드챔피언십(롤드컵) 정상에 오른 유일한 e스포츠 프로선수’라는 업적을 다시 주목받았다. 28일 스페인 게임매체 ‘에스포르트마니아코스’는 “듀크는 여전히 두 팀으로 롤드컵을 제패한 유일한 프로게이머다. 리그오브레전드(LoL) 톱 레인(Top lane) 포지션에서 의심할 여지 없는 한국인 역대 최고로 2019년 현역 생활을 마무리했다”고 주장했다. 듀크는 2016년 T1(한국), 2018년 인빅터스(중국) 소속으로 롤드컵 우승을 차지했다. 서로 다른 게임단·리그에서 리그오브레전드 세계 정상을 경험한 e스포츠 역사상 처음이자 여전히 마지막 사례다.   중국 프로게임단 인빅터스 시절 듀크. 사진=리그오브레전드 e스포츠 공식 홈페이지  ‘에스포르트마니아코스’는 ▲넓은 챔피언 범위 ▲좋지 않은 매치업에 적응하는 능력 ▲신중한 플레이를 현역 시절 듀크 장점으로 꼽았다. 듀크는 2016년 롤드컵 다음가는 세계대회 ‘미드 시즌 인비테이셔널(MSI)’ 정상에도 올랐다. 리그오브레전드 톱 레인 포지션으로 롤드컵과 MSI를 둘 다 우승한 프로게이머는 이전뿐 아니라 이후에도 나오지 않고 있다. ‘에스포르트마니아코스’는 “e스포츠 유일한 업적들을 세웠음에도 미디어가 많이 보도하는 선수가 아니었다. 이런 경향이 현역 시절 내내 이어진 것”을 과소평가 이유라고 봤다."
"'쵸비' 정지훈, T1전? ""경기 결과로 보면 돼…노래는 기분 좋으면 부를 수도"" [인터뷰]",https://mimgnews.pstatic.net/image/origin/311/2022/07/29/1482342.jpg,https://m.news.naver.com/read.nhn?oid=311&aid=0001482342,https://sports.news.naver.com/news.nhn?oid=311&aid=0001482342,https://n.news.naver.com/sports/esports/article/311/0001482342,엑스포츠뉴스,14,5500,2022-07-29T05:31:01,2022-07-29T05:31:01,"(엑스포츠뉴스 김수정 기자) '쵸비' 정지훈이 T1전 승리에 강한 열의를 보였다. 지난 28일 서울 종로구에 위치한 롤파크에서는 '2022 LCK 서머' 2라운드, 젠지 대 DRX의 맞대결이 펼쳐졌다. 이날 1, 2세트 모두 좋은 흐름을 이어가며 2 대 0 완승을 거둔 젠지는 12승 1패, 세트 득실 +22를 기록하며 T1을 밀어내고 1위를 탈환하는 데 성공했다. 경기가 끝난 후 진행된 기자 공동 인터뷰에서 정지훈은 ""DRX 상대로 2 대 0 승리를 하고 연승을 이어가서 기분이 좋다""라고 밝혔다. 팀원들이 잘해준 덕분에 승리할 수 있었다고 말한 정지훈은 상대팀이었던 DRX에 대해 ""'제카' 선수가 잘하는 것 같아서 '제카' 선수 위주로 신경을 썼다. 미드 라인전에서 생각한 구도를 벗어나지 않아서 게임이 쉽게 흘러갔다""라고 설명했다. 정지훈은 앞서 라이엇 공식 인터뷰에서 'T1전 패인을 알고 있다'고 고백했다. 이에 관해 그는 ""평소에 잘하던 플레이들이 안 나왔고 아쉬운 플레이를 선택했다. 그런 자잘한 부분들 때문에 졌다고 생각하기 때문에 왜 졌는지 안다고 말했다. 경기 결과로 보면 될 것 같다""라며 자신감 있는 태도를 보였다. '도란' 최현준에게 T1전 승리 공약으로 '노래 부르기'를 추천한 정지훈은 ""내가 부르겠다고 한 게 아니라 도란 선수에게 추천한 것""이라고 강조하면서도 ""이기고 나서 생각해 보겠다. 기분이 좋으면 할 수도 있을 것 같다""라며 여지를 남겼다. 다음은 정지훈과의 인터뷰 전문이다. > 오늘 승리를 거뒀는데 소감이 어떤가? DRX 상대로 2 대 0 승리를 하고 연승을 이어가서 기분이 좋다. > 완승을 거둔 이유가 뭐라고 생각하는지? 팀원들이 다 잘해줬고 열심히 했기 때문에 좋은 결과가 나왔고 이길 수 있었다. > DRX를 어떻게 평가했고, 어떤 점을 주의하면서 경기를 했나? '제카' 선수가 잘하는 것 같아서 '제카' 선수 위주로 신경을 썼다. 미드 라인전에서 생각한 구도를 벗어나지 않아서 게임이 쉽게 흘러갔다. > 미드에서 1, 2세트가 같은 구도였지만 다른 보조 룬을 선택했는데 이유가 무엇인지? 평소 아리로 지배를 선호하는데, 1세트 같은 경우 시비르가 있고 게임이 길어질 것 같아서 폭풍의 결집을 선택했고, 2세트는 게임이 빨리 끝날 것 같아 지배룬을 선택했다. > DRX전 각 세트의 승부처는 어디라고 생각하는지 궁금하다. 1세트는 전령을 바텀에서 풀고 첫 포탑을 가져갔을 때 유리하다고 생각했고, 2세트는 미드에서 스펠 교환과 킬 교환이 나온 후 아리, 바이 조합으로 유리하게 풀어갈 수 있다고 생각했다. > 아리 성적이 굉장히 좋다. 본인의 스타일과 어떤 점이 맞아서 좋은 성적이 나오는 것 같은지? 아리는 진입을 잘해야 하는데 플레이할 때 제가 그 각을 잘 본다고 생각한다. 또, 상대팀에게 위협적일 정도로 성장을 잘 해야 하는데 저는 그에 맞춰 성장을 잘할 수 있어서 좋다고 생각한다. > 사거리가 길고 포킹이 많은 상대로 밴시의 장막을 올렸다. 아리는 대치 구도에서 상대 스킬을 맞는 것보다 사이드 관리를 하고 돌아다니면서 이니시를 거는 게 좋다고 생각한다. 그런 상황일 때 조금 더 안정적이라서 밴시의 장막을 선택했다. 스킬을 하나 흘리거나 사이드에서 혹시라도 갱킹을 당했을 때 피 관리가 쉬워지기 때문에 좋은 것 같다. > 1라운드 T1전 이후로 어떤 피드백이 나왔는지? 평소에 잘하던 플레이들이 안 나왔고 아쉬운 플레이를 선택했다. 그런 자잘한 부분들 때문에 졌다고 생각하기 때문에 왜 졌는지 안다고 말했다. 경기 결과로 보면 될 것 같다. > '피넛' 한왕호 선수가 T1전 패배 후에 밴픽에 대해 더 길게 얘기한다고 했는데 어떤 효과가 있는지 궁금하다. 밴픽 구도를 짤 때 많은 생각이 필요한데 준비 시간을 길게 가지면 더 많은 상황에 대처할 수 있기 때문에 그런 말이 나오지 않았나 생각한다. > 오늘 처음으로 12.13 패치 경기를 치렀는데 미드 라인 메타에 변화가 있다고 생각하는지? 미드는 딱히 변화가 없어서 위화감을 못 느꼈다. 큰 문제는 없을 것 같다. > 성장, 싸움은 압도적인데 킬 관여율은 낮다. 팀을 믿기 때문인가? 사이드에 있을 때 팀원들이 먼저 싸우고 킬을 낸다. 나도 싸우고 싶지만 기회가 없다. > T1전을 이기면 노래를 부르겠다고 했는데? 내가 부르겠다고 한 게 아니라 도란 선수에게 추천한 거다. 이기고 나서 생각해 보겠다. 기분이 좋으면 할 수도 있을 것 같다. > 마지막으로 하고 싶은 말이 있다면? 좋은 결과 낼 수 있도록 열심히 노력하겠다. 또, 팬분들에게 항상 감사하다고 전하고 싶다. 사진=엑스포츠뉴스DB"
