title,thumbnail,linkUrl,pcLinkUrl,mobileLinkUrl,officeName,rank,hitCount,updatedAt,createdAt,content
"미드 상성 정리돼있는 '쵸비' 정지훈 ""T1전 패인 알고 있다…잘 준비할 것"" [LCK]",https://mimgnews.pstatic.net/image/origin/311/2022/07/28/1482077.jpg,https://m.news.naver.com/read.nhn?oid=311&aid=0001482077,https://sports.news.naver.com/news.nhn?oid=311&aid=0001482077,https://n.news.naver.com/sports/esports/article/311/0001482077,엑스포츠뉴스,1,23071,2022-07-28T16:27:01,2022-07-28T13:40:01,"(엑스포츠뉴스 김수정 기자) '쵸비' 정지훈이 T1전 각오를 전했다. 28일 서울 종로구에 위치한 롤파크에서는 '2022 LCK 서머' 2라운드, 젠지 대 DRX의 경기가 치러졌다. 이날 완벽한 경기력을 자랑하며 1, 2세트 모두 압도적인 승리를 거둔 젠지는 6연승을 달성하는 동시에 1위를 탈환하는 데 성공했다. 경기가 끝난 후 진행된 라이엇 공식 인터뷰에서 '도란' 최현준은 ""이번 주가 중요한 경기라고 생각했는데 2-0으로 깔끔하게 이겨서 다행이라고 생각한다""라는 소감을 전했다. 정지훈 역시 ""DRX가 잘하는 팀이라고 생각하는데 깔끔하게 이겨서 다행이다""라고 말했다. 1세트에서 빠르게 세주아니를 가져온 최현준은 ""세주아니는 다른 챔피언보다 든든하고 나르, 갱플랭크는 많이 했기 때문에 세주아니를 선택했다""라고 밝혔다. 이어 ""1라운드 DRX전 때도 탑을 많이 오더라. 탑을 너무 많이 와서 의식을 하고 있었다""라며 '표식' 홍창현의 플레이 스타일을 파악하고 있었음을 알렸다. 최근 물오른 경기력을 보이고 있지만 본인 기량에 만족하지 않는다는 최현준은 ""(제 기량은) 평범한 수준이라고 생각한다. 더 잘할 수 있다고 생각해서 기대를 하고 있다""라고 털어놨다. 1, 2세트 모두 아리를 픽한 정지훈은 ""미드 챔피언은 상성 같은 게 정리돼있어서 상대가 무엇을 하면 저는 무엇을 할 수 있다는 걸 알고 그에 따라 조합을 맞추는데 그게 아리였다""라고 설명했다. 아리로 11전 전승을 달리고 있는 것에 대해서는 ""잘 모르겠지만 기본기가 좋아서 승률이 잘 나오는 것 같다""라며 ""제 아리 별거 없으니까 상대해도 될 것 같다""라고 말했다. 금일 경기에서 글로벌 골드 차이를 크게 벌렸던 젠지. 이에 관해 정지훈은 ""저희 (한)왕호 형이 잘해서 그런 골드 차이가 나온 것 같다""라고 전했고, 최현준 역시 '피넛' 덕분이라고 밝혔다. 곧 T1을 상대하게 될 정지훈은 ""스프링 시즌에는 여러 이슈가 있어서 (T1에게) 진 거고, 1라운드에서는 왜 진 것인지 알고 있으니까 잘 준비하면 이길 수 있을 것 같다""라고 강조했다. 앞서 젠지를 꺾으면 춤을 추겠다는 공약을 내세운 '구마유시' 이민형. 이에 맞서 정지훈은 최현준에게 ""T1 사옥에 노래방이 있다고 들었는데 이기면 T1 노래방에 가서 노래를 부르는 게 어떠냐""라고 제안했고, 최현준은 ""그런 것보다는 저도 한 춤 추기 때문에 제가 추도록 하겠다""라는 공약을 걸었다. 사진=엑스포츠뉴스DB"
중앙노동위원위도 김정수 감독 손 들어줘...디알엑스는 여전히 '불복',https://mimgnews.pstatic.net/image/origin/109/2022/07/29/4667942.jpg,https://m.news.naver.com/read.nhn?oid=109&aid=0004667942,https://sports.news.naver.com/news.nhn?oid=109&aid=0004667942,https://n.news.naver.com/sports/esports/article/109/0004667942,OSEN,2,20263,2022-07-29T05:39:03,2022-07-29T05:39:03,"[OSEN=고용준 기자] 상급 기관의 결론도 결국 부당해고였다. 중앙노동위원회가 김정수 감독과 관련한 디알엑스의 부당해고 재심 구제신청을 기각했다.  중앙노동위원회는 지난 19일 디알엑스주식회사가 제기한 부당해고 재심 청구를 기각했다. 즉 지난 4월 서울지방노동위원회가 판정한대로 김정수 감독을 복직시키고, 미지급한 임금을 지급하라는 판정을 내렸다. 디알엑스는 지난 2월 4일 시즌 개막 5경기만에 김정수 감독을 전격 경질하였으나, 김 감독 측은 회사가 허락한다면 관련 사실을 모두 공개하고 싶다고 밝히며 법적 대응을 예고, 논란에 휩싸인 바 있다.  지난 4월 서울지방노동위원회가 디알엑스의 김정수 감독 부당해고를 인정함과 동시에 원직 복귀 판정을 내렸지만, 이에 불복한 디알엑스는 지난 5월 29일 법률대리인 법률사무소 새로를 내세워 입장을 밝혔고, 중앙노동위원회에 재심을 청구했다.  하지만 달라진 건 없었다. 중앙노동위원회는 다시 한 번 김정수 감독의 손을 들어주면서 부당해고라는 판정을 내렸다.  이번 중앙노동위원회의 판정에 대한 OSEN의 문의에 디알엑스의 법률대리인은 지난 5월 29일 발표한 입장문 외 추가적인 의견이나 내용은 전달하지 않았다. 디알엑스 법률대리인 새로는 앞서 '통상적으로 중앙노동위원회는 지방노동위원회와 결을 같이 하는 결정을 내리기 때문에 정당한 판결을 받기 위해서는 행정소송을 진행하겠다'라는 입장을 밝힌 있다.  새로측은 ""서울지방노동위원회의 결정문을 전달받고, 중앙노동위원회에 재심을 청구할 수 있는 기간 10일, 중앙노동위원회의 심리 기간 2~4개월, 중앙노동위원회의 결정에 대해서 소송을 제기할 수 있는 기간 15일, 이후 1심 행정소송 기간 3~9개월 정도를 고려하면 1심 결론을 얻는데 1년 이상의 기간이 소요될 수 있고, 2심 혹은 3심까지 진행을 한다면 3~5년이 걸릴 수 있다""며 법정 다툼을 예고했다.  김정수 감독의 에이전트인 쉐도우코퍼레이션 박재석 대표는 ""정말 중요한 한 고비를 넘겼다는 생각과 준비 과정이 정말 쉽지 않다는 생각이 들었다. 변호사님들과 김정수 감독에게 고생했다는 말을 전하고 싶고 , 서로가 원만하게 합의하기를 바란다는 생각을 디알엑스측에 전달 하고 싶다""고 입장을 밝혔다. / scrapper@osen.co.kr"
[오피셜] T1 와일드 리프트 팀과 여정 마무리,https://mimgnews.pstatic.net/image/origin/236/2022/07/29/226114.jpg,https://m.news.naver.com/read.nhn?oid=236&aid=0000226114,https://sports.news.naver.com/news.nhn?oid=236&aid=0000226114,https://n.news.naver.com/sports/esports/article/236/0000226114,포모스,3,16010,2022-07-29T09:35:01,2022-07-29T09:03:01,"T1이 지난해부터 함께해 온 와일드 리프트 팀과 작별한다. T1은 29일 공식 소셜 네트워크 채널 등을 통해 와일드 리프트 팀의 여정을 마무리하게 됐다고 발표했다. T1 와일드 리프트 팀은 지난해 7월 ‘왕자영요’ 출신의 선수들을 주축으로 창단됐으며, 2021 와일드 리프트 라이벌스: LCK vs. LPL 인비테이셔널을 시작으로 우리나라에서 개최된 와일드 리프트의 대회에 꾸준히 참가했다. 최고 성적은 2022 와일드 리프트 챔피언스 코리아 프리시즌 인비테이셔널 우승이며 2022 와일드 리프트 챔피언스 코리아 스프링서 3위에 입상하며 국제 대회인 2022 와일드 리프트 아이콘스 글로벌 챔피언십에 롤스터Y, 광동 프릭스 등과 함께 WCK 대표로 참가했다. 한편 T1은 글을 마무리하며 “매 경기 활약해 준 '준' 김영준 코치, '쫑' 박경민 선수, '제이와이' 이준 선수, '코어' 정용훈 선수, '비디쥐' 김동영 선수, '펭귄' 이경호 선수에게 감사드리며, 이들의 새로운 도전을 응원하겠다.“라고 인사를 전했다."
[LCK] 구마유시 도발 본 리헨즈 “나이가 들어서 그런가…재밌고 별 생각 안들어”,https://mimgnews.pstatic.net/image/origin/236/2022/07/29/226098.jpg,https://m.news.naver.com/read.nhn?oid=236&aid=0000226098,https://sports.news.naver.com/news.nhn?oid=236&aid=0000226098,https://n.news.naver.com/sports/esports/article/236/0000226098,포모스,4,15992,2022-07-29T07:31:01,2022-07-29T07:31:01,"“T1과의 대결에서 누가 이길지 기대된다. 나이가 들어서 그런지 구마유시 선수의 도발은 재밌고 별 생각 안든다” 28일, 젠지가 압도적인 경기력을 뽐내며 DRX를 상대로 2대 0 승리를 가져갔다. 경기 후 포모스와의 인터뷰에 응한 ‘리헨즈’ 손시우가 자신의 생각을 전했다. 승리 소감으로 “2대 0으로 연승을 이어나갈 수 있어 좋다”고말한 손시우. 그는 ‘데프트-베릴’ 듀오와의 대결에서 완승을 거둔 부분과 관련해 “개인적으로 실력 차이가 많이 난다고 느끼지는 않는다. 밴픽 단계의 유리함으로 인해 이길 수 있엇따고 생각한다”며 DRX 바텀 듀오와의 대결 승리 원인을 밴픽으로 꼽았다. 1세트. 젠지의 바텀 듀오는 DRX의 시비르-질리언 조합을 제리와 라칸으로 맞받아쳤다. “제리와 라칸은 시너지가 거의 없다고 봐도 무방하다”고 말한 손시우. 그는 “상대가 라칸을 선택하지 못하게 하기 위해 라칸을 선택했다”는 챔피언 선택 이유를 밝혔다. 7주차 패치를 통해 버프된 시비르에 대한 그의 생각도 들어볼 수 있었다. 그는 “패치 이후 LPL에서도 많이 기용되고 LCK 연습 과정에서도 많이 선택된다. 좋은 챔피언이라고 생각한다”며 챔피언에 대해 평가한 뒤, “시비르의 장점은 라인 클리어 기계다”라며 시비르를 통해 쉽게 게임을 장기전으로 끌고 나갈 수 있따는 생각을 전했다. 2세트에서 레나타 글라스크를 기용한 손시우. 7주차 그의 선택으로 레나타 글라스크가 다시 협곡에 모습을 드러낸 것과 관련해 “레나타가 자주 등장할 수 있었떤 이유는 상대법을 몰랐기 때문이다. 하지만 이제 상대법이 나오고 있다보니 장단점이 확실하게 드러나고 있다. 레나타 글라스크를 부정적으로 평가하고 있는 팀도 있었던 것 같다”며 레나타 글라스크가 이전과 같은 OP 챔피언은 아닐 것이라고 이야기했다. 그는 레나타 글라스크로 ‘아이오니아의 장화’를 먼저 올려 기동성에 힘을 실었다. 손시우는 칼리스타와 제리의 1대 1 구도를 만들어주기 위해 위와 같은 아이템 선택을 했음을 밝혔다. “바텀 원거리 딜러 1대 1 구도에서는 칼리스타가 당연히 이기기 때문에 룰루를 상체로 끌어올리고 싶었다. 신발을 통해 빠르게 이동할 수 있는 발판을 마련하려 했고, 룰루가 점화석을 먼저 구매한 것을 확인하고는 게임을 유리하게 끌고갈 수 있을 것이라고 생각했다”며 당시 상황을 회상했다. 젠지의 다음 상대는 우승을 위한 가장 큰 라이벌 T1이다. “누가 이길지 기대된다”는 기대감을 드러낸 손시우. 그는 ‘구마유시’ 이민형의 도발과 관련해 “나이가 들어서 그런가 재밌고 별 생각이 안든다”며 유쾌한 모습을 보이기도 했다. T1과의 대결에서 신경써야 될 부분에 대해 묻자 ‘오너’ 문현준을 언급하며 “변칙적인 선수다. 베테랑적인 면모도 있어서 굉장히 잘한다고 생각한다”는 생각을 밝혔다. 마지막으로 그는 “계속 이기고 있지만 신경 쓰지 않겠다. 다음 경기가 처음이라고 생각하고 이기도록 하겠다”는 각오를 밝히며 인터뷰를 마쳤다."
"EG '임팩트' 정언영, LCS 역사상 최고 탑 라이너 선정",https://mimgnews.pstatic.net/image/origin/347/2022/07/29/165039.jpg,https://m.news.naver.com/read.nhn?oid=347&aid=0000165039,https://sports.news.naver.com/news.nhn?oid=347&aid=0000165039,https://n.news.naver.com/sports/esports/article/347/0000165039,데일리e스포츠,5,11744,2022-07-28T16:19:01,2022-07-28T16:19:01,"이블 지니어스(EG) '임팩트' 정언영이 북미 LCS 역사상 가장 최고의 탑 라이너로 선정됐다.  라이엇 게임즈는 지난 27일 홈페이지를 통해 북미 LCS 10주년을 맞아 전문가 패널의 도움을 받아 포지션별 LCS 최고 선수를 발표했다. 가장 먼저 탑 라이너를 공개했는데 '임팩트' 정언영이 선정됐다.  지난 2012년 제닉스 스톰에서 데뷔한 정언영은 2013년 SK텔레콤 T1(현 T1) 2팀으로 이적했다. 단일팀으로 제도가 바뀐 이후 정언영은 2013년 LCK 전신인 리그 오브 레전드 챔피언스 서머, 리그 오브 레전드 월드 챔피언십(롤드컵) 시즌3서 우승을 경험했다.  2014년 LoL 챔피언스 윈터서 삼성 화이트(해체)를 꺾고 우승을 차지한 정언영은 2015시즌을 앞두고 팀 임펄스로 이적했다. 이후 그는 클라우드 나인, NRG, 팀 리퀴드에서 뛰었으며 2021시즌을 앞두고 EG에 합류해 현재까지 주전 탑 라이너로 활동 중이다.  2위는 100씨브즈 '썸데이' 김찬호가 선정됐다. 3위는 TSM, 골든 가디언스 등에서 활동했던 '하운처' 케빈 야넬, 4위는 '북미의 영웅'인 '다리러스' 마커스 힐에게 돌아갔다. 공동 5위는 '다르샨'  다르샨 우파드하야와 '볼스' 안 레가 차지했다."
"'도란' 최현준 ""늘 제 역할 잘하고 싶어…T1전, 이젠 우리가 이길 때"" [인터뷰]",https://mimgnews.pstatic.net/image/origin/311/2022/07/29/1482244.jpg,https://m.news.naver.com/read.nhn?oid=311&aid=0001482244,https://sports.news.naver.com/news.nhn?oid=311&aid=0001482244,https://n.news.naver.com/sports/esports/article/311/0001482244,엑스포츠뉴스,6,9868,2022-07-29T01:31:01,2022-07-29T01:31:01,"(엑스포츠뉴스 김수정 기자) ""많은 탑 라이너 분들이 저와 같은 생각을 할 것 같은데, 항상 제 역할을 잘 하고 싶어요."" 지난 28일 서울 종로구에 위치한 롤파크에서는 '2022 LCK 서머' 2라운드, 젠지 대 DRX의 경기가 치러졌다. 이날 경기에서 젠지는 '왜 젠지가 1위 팀인지'에 대해 완벽히 증명해 보였다. 선수 개개인의 기량을 앞세워 전 라인 주도권을 쥐었고, 초반 얻은 이득을 통해 빠르게 스노우볼을 굴리며 DRX가 성장할 틈도 없이 경기를 끝내버렸다. DRX전 압도적인 2 대 0 승리를 거두며 다시 1위를 탈환하는 데 성공한 젠지. 그중 1세트에서 세주아니, 2세트에서는 갱플랭크를 픽한 '도란' 최현준은 라인전과 한타 등 전반적인 부분에서 활약하며 팀 승리에 큰 힘을 보탰다. 경기가 끝난 후 진행된 엑스포츠뉴스와의 인터뷰에서 최현준은 ""이번 주 두 경기 다 중요해서 (DRX전을) 깔끔하게 이기고 싶었는데 2 대 0으로 이겨서 기분 좋다""라는 소감을 전했다. 2세트에서 갱플랭크로 '자객의 발톱'을 올린 그는 ""갱플랭크의 템트리 중에서 자객의 발톱이 가장 대미지가 센 것으로 알고 있다""라고 말하며 ""단점은 몸이 너무 약하고 기동성이 부족해서 상대 노림수에 당하기 쉽다는 것""이라고 부연했다. 12.13 패치에서 리워크 되며 더 강력해졌다는 평가를 받는 그웬에 대해 최현준은 ""예전보다 대미지가 세진 느낌""이라면서도 ""아직까지는 나르가 탑에서 1티어를 유지하고 있다고 생각한다. 나르 VS 그웬 구도는 대회를 더 지켜봐야 구체적으로 알 수 있을 것 같다""라고 밝혔다. 늘 본인의 역할을 잘 하고 싶다고 말한 최현준의 다음 상대는 T1이다. 각오를 묻자 그는 ""지금까지는 T1한테 번번이 패배했는데, 이제는 저희가 이길 때라고 생각하고 이길 수 있다고 생각한다. 느낌이 좋다""라며 자신 있는 모습을 보였다. 다음은 최현준과의 인터뷰 전문이다. > 오늘 승리를 거두며 다시 1위에 올라섰다. 소감이 어떤가? 이번 주 두 경기 다 중요해서 (DRX전을) 깔끔하게 이기고 싶었는데 2 대 0으로 이겨서 기분 좋다. > 1세트에서 DRX가 별다른 실수를 하지 않았는데도 젠지가 압도적인 승리를 거뒀는데 이유가 뭐라고 생각하는지? 저희가 교전에서 조금씩 이득을 보고 있던 게 누적이 되고, 스노우볼이 돼서 게임이 유리하게 흘러간 것 같다. > 1세트에서 유리한 상황에 '룰러' 박재혁 선수가 앞으로 돌진하면서 죽게 됐는데, 이때 팀원들끼리 어떤 이야기를 나눴나? 살 사람은 살아야 하니까 '산 사람은 알아서 도망치자'고 했다. 또, 다음 해야 할 플레이에 대해 이야기했다. > 2세트에서 자객의 발톱을 갔는데, '자객의 발톱 갱플랭크'의 장점을 꼽자면? 갱플랭크의 템트리 중에서 자객의 발톱이 가장 대미지가 센 것으로 알고 있다. 단점은 몸이 너무 약하고 기동성이 부족해서 상대 노림수에 당하기 쉽다는 것이다. > 2세트에서 유리했던 경기가 조금 이상하게 흘러가기도 했는데, 팀원들과 어떤 대화를 나누며 집중력을 끌어올렸나? 2세트 때 저희 팀이 욕심을 부리다가 교전에서 손해를 봤는데, 그때부터 다시 오브젝트 위주로 싸움을 하면서 '천천히 하자'고 했다.  > 7주 차에 12.13 패치가 적용됐는데 변화가 느껴지는지? 느껴지는데 탑 라이너 입장에서 가장 많이 느껴지는 건 그웬일 것 같다. 그웬이 변경되면서 예전보다 대미지가 세진 느낌이라 탑 라이너들이 그웬을 유심히 지켜보고 있다. > '도란' 선수가 말한 바와 같이 그웬이 리워크 되면서 더욱 강력해졌다. 이전까지 탑은 나르가 꽉 잡고 있었는데 그웬이 나르의 상승세를 막을 수 있을까? 저는 아직까지는 나르가 탑에서 1티어를 유지하고 있다고 생각한다. 나르 VS 그웬 구도는 대회를 더 지켜봐야 구체적으로 알 수 있을 것 같다. > 젠지가 이번 시즌 파괴적인 경기력을 자랑하고 있는데 비결이 있다면? 하다 보니까 팀원들끼리 합이 더 잘 맞게 돼서 게임이 빠르게 굴러가는 것 같다(웃음). > 2라운드 남은 경기에서 탑 라이너로서 보여주고 싶은 모습이 있는지? 많은 탑 라이너 분들이 저와 같은 생각을 할 것 같은데, 항상 제 역할을 잘 하고 싶다. 특히 탑은 그 정도만 해도 팀에게 도움이 된다고 생각해서 제 역할을 조금 더 잘하고 싶다. > 다음 대결 상대는 T1이다. 1위를 지키기 위해서는 T1을 반드시 잡아야 하는데, 각오 한마디 부탁드린다. 지금까지는 T1한테 번번이 패배했는데, 이제는 저희가 이길 때라고 생각하고 이길 수 있다고 생각한다. 느낌이 좋다. > 마지막으로 팬분들께 하고 싶은 말이 있다면? 항상 꾸준히 응원해 주셔서 감사드리고, 다음 경기가 모든 팬분들이 가장 기대하실 매치인 것 같은데 승리해서 보답할 수 있도록 잘 준비하겠다. 사진=엑스포츠뉴스DB"
"[LCK 톡톡] '쵸비' 정지훈의 가라사대, ""T1과 2R, 경기 결과로 보면 될 것""",https://mimgnews.pstatic.net/image/origin/109/2022/07/29/4667861.jpg,https://m.news.naver.com/read.nhn?oid=109&aid=0004667861,https://sports.news.naver.com/news.nhn?oid=109&aid=0004667861,https://n.news.naver.com/sports/esports/article/109/0004667861,OSEN,7,9088,2022-07-29T02:47:04,2022-07-29T02:47:04,"[OSEN=종로, 고용준 기자] '쵸비' 정지훈이 단단히 벼르고 있다. 그는 다시 만나는 맞수 T1전을 기다리고 있었다. 그는 아쉬웠던 T1과 1라운드 승부를 복기하면서 ""패배의 이유를 안다""라고 언급했던 방송 인터뷰를 더 구체적으로 설명했다. 정지훈은 ""2라운드는 경기 결과 보면 될 것 같다""면서 1라운드와는 다른 결과를 이끌어내겠다는 의지를 피력했다.  젠지는 28일 오후 서울 종로 롤파크 LCK아레나에서 열린 ‘2022 LOL 챔피언스 코리아(이하 LCK)’ 서머 디알엑스와 2라운드 경기서 압도적인 화력의 힘을 보이면서 2-0 완승을 거뒀다. 이 승리로 6연승을 달린 젠지는 시즌 12승(1패 득실 +22)째를 올리면서 내줬던 선두 자리를 하루만에 다시 찾았다.  1, 2세트 아리로 팀 화력의 중심이 된 정지훈은 소환사의 협곡을 뒤흔들면서 2세트 POG에 선정됐다.  경기 후 취재진과 만난 정지훈은 ""디알엑스를 상대로 2:0승리를 하고 연승을 이어가서 기분이 좋다""고 웃으면서 ""팀원들이 다 잘해줬고 열심히 했기 때문에 좋은 결과가 나왔고 이길 수 있었다""라고 완승을 한 소감을 전했다.  이날 경기에 대한 총평을 묻자 그는 ""제카 선수가 잘 하는 것 같아서 제카 선수 위주로 신경을 썼다. 미드 라인전에서 생각한 구도를 벗어나지 않아서 게임이 쉽게 흘러갔다""면서 ""아리로 지배를 선호하는데 1세트 같은 경우 시비르가 있고 게임이 길어질 것 같아서 폭풍의 결집을 선택했고, 2세트는 게임이 빨리 끝날 것 같아 지배룬을 선택했다""며 1, 2세트 동일하게 탈리아와 대치한 미드 구도에서 다른 보조 룬을 선택한 이유를 밝혔다.  각 세트의 승부처에 대해 정지훈은 ""1세트는 전령을 바텀에서 풀고 첫 포탑을 가져갔을 때 유리하다고 생각했고, 2세트는 미드에서 스펠 교환과 킬 교환이 나오고 아리, 바이 조합으로 유리하게 풀어갈 수 있다고 생각했다""고 답변했다.  정지훈은 이번 서머 시즌 5번 아리를 잡아 무려 평균 KDA 17.67(25킬 3데스 28어시스트)이라는 놀라운 경기력을 선보이고 있다. 정지훈은 '아리'라는 챔피언에 대한 남다른 자신감도 피력했다.  ""아리는 진입을 잘해야 하는데 플레이할 때 각을 잘 본다고 생각하고 위협적일 정도로 성장을 잘 해야 하는데 그에 맞춰서 성장을 잘 할 수 있어서 좋다고 생각한다. 아리는 대치 구도에서 상대 스킬을 맞는 거보다 사이드 관리를 하고 돌면서 이니시를 거는 게 좋다고 생각한다. 그런 상황일 때 조금 더 안정적이라 밴시의 장막을 선택 했다. 스킬을 하나 흘리거나 사이드에서 혹시라도 갱킹을 당했을 때 피관리가 쉬워지기 때문에 좋은 것 같다."" 오는 30일 다시 맞붙는 소위 '정상 대전'이라는 T1전에 대한 각오도 전했다.  ""T1과 1라운드는 평소에 잘하던 플레이들이 안 나왔고 아쉬운 플레이를 선택했다. 그런 자잘한 부분들 때문에 졌다고 생각하기 때문에 왜 졌는지 안다고 말했다. 경기 결과로 보면 될 것 같다."" T1전 승리 이후 노래를 부르겠다고 했던 것과 관련해서도 그는 ""내가 부르겠다고 한 게 아니라 도란 선수에게 추천한 거다. 이기고 나서 생각해 보겠다 기분이 좋으면 할 수도 있겠다""고 웃으면서 ""2라운드 마지막 까지 좋은 결과 낼 수 있도록 열심히 노력하고 팬분들에게 항상 감사한 마음 전하고 싶다""며 인터뷰를 마무리했다. / scrapper@osen.co.kr"
