title,thumbnail,linkUrl,pcLinkUrl,mobileLinkUrl,officeName,rank,hitCount,updatedAt,createdAt,content
[LPL] BLG의 '돌림판도라의 상자',https://mimgnews.pstatic.net/image/origin/445/2022/07/29/62639.jpg,https://m.news.naver.com/read.nhn?oid=445&aid=0000062639,https://sports.news.naver.com/news.nhn?oid=445&aid=0000062639,https://n.news.naver.com/sports/esports/article/445/0000062639,MHN스포츠,34,991,2022-07-29T02:31:01,2022-07-29T02:31:01,"사진=BLG 공식 웨이보 (MHN스포츠 이솔 기자) 열지 말아야 했던 '판도라의 상자' 처럼, 돌리지 말아야 할 돌림판을 돌린 BLG가 결국 큰 대가를 치른 끝에 마지막 남은 '희망'을 봤다. 지난 28일 오후 6시, 중국 현지에서 온라인으로 펼쳐진 2022 LPL 서머 8주 4일차 경기에서는 iG가 UP를 2-1로, FPX가 BLG를 각각 2-0으로 눌렀다. 두 경기 모두 낮은 순위의 팀이 높은 순위의 팀을 꺾는, 순위표 상 이변이라고 할 수있었던 가운데 이 틈 사이에 꼈던 WE는 플레이오프 탈락을 한 번 미뤘다. 1경기에서는 '돌풍 후배' 몰(2020 서머 V5)이  '돌풍 선배' 크라인(2020 스프링 이스타)에게 완승한 iG가 승리를 거뒀다. 로밍, 한타 포지셔닝, 팀원과의 호흡 등 교전 분야의 모든 면에서 크라인을 압도한 몰은 1세트 아리, 3세트 조이로 상대 크라인(스웨인-탈리야)보다 빠른 로밍을 통해 '몰' 보여주는 활약을 펼치며 팀의 승리를 이끌었다. 사진=LPL(영문) 공식 유튜브 채널, 2022 LPL 서머 FPX-BLG, 1-2SET 빈의 솔로킬 본격적인 플레이오프 경쟁이 걸렸던 2경기에서는 BLG의 '돌림판'이 시즌 막판에서야 제 궤도에 올랐다. 밤 12시에 2군행 짐을 싼 도고, 이를 뒤늦게서야 통보받은 그의 동료 크리스프, 비록 농담이지만 '쫒겨났다'는 발언으로 팬들의 우려를 산 웨이웨이, 그리고 무패에서 연패로 급전직하한 2군 선수단 등 '돌림판도라의 상자'를 연 대가는 혹독했다. 그러나 악재가 모두 터져나온 '돌림판도라의 상자'의 밑바닥에서 BLG는 희망을 봤다. 이날 경기에서 드러난 '돌림판도라의 상자'의 첫 번째 선물은 '힘'이었다. 특히 탑에서는 빈이 잭스-나르를 바꿔가며 서밋을 압살하는 '탑 원데이 클래스'를 열었다. 이전까지 힘싸움에서 상대에게 압도당하는 것이 상수였던 BLG는 1세트 초반 적극적으로 5-5 교전을 유도, 전령싸움에서 전령-미드 교전에서 앞서갔다. 13분 교전에서 탑 1-1, 바텀 4-4 교전이 펼쳐진 가운데, 탑에서는 빈(나르)이 서밋(잭스)을 상대로 솔로킬을 바텀에서는 웨이웨이의 칼같은 돌진에 이은 '점사'로 4-0 완승, 에이스를 띄웠다. 빈의 개인적인 '힘'도, 본대의 팀워크에 기반한 '힘'도 모두 느낄 수 있는 장면이었다. 초반부터 벌어진 격차를 계속해서 이어간 BLG는 햇바론-미드 억제기(23분) 격파 후 26분 넥서스를 깨며 첫 세트를 가져갔다. 사진=LPL(영문) 공식 유튜브 채널, 2022 LPL 서머 FPX-BLG, 2SET BLG의 빈틈 노리기 전략 '돌림판도라의 상자'가 준 두 번째 선물은 '전략'이었다. 이전까지 라인전을 이기는 경우에도 갈 곳을 잃었었던 BLG는 본지가 '돌고래 싸움에 플랑크톤 등 터진다'기사에서 지적한 FPX의 TT전 패인, 스플릿 푸셔를 2세트에서 완벽하게 잘라내며 승기를 가져왔다.  이전까지 케어(아칼리)가 10분만에 4킬을 올리며 미드-정글 싸움에서 불리한 상황에 처했으나 BLG는 미드라인에서 사일러스와 아칼리를 대치시켰고, 룰루가 바텀라인을 포기하면서도 계속해서 미드라인으로 향하며 아칼리의 로밍을 차단했다.  특히 웨이웨이의 지원을 받은 빈(잭스)은 '무지성 돌격' 대신 상대의 빈틈을 파고드는 플레이로 서밋을 계속해서 쓰러트리며 서밋의 활약을 막아세웠다. 결국 21분경 벌어진 5-5 교전에서 또 한번 일방적인 에이스를 만들어 낸 BLG는 바론에 이은 돌려깎기로 상대를 압박, 27분 뛰쳐나오던 상대를 모두 정리하며 또 승리를 결정지었다. 사진=LPL(영문) 공식 유튜브 채널, 2022 LPL 서머 8주 4일차 경기종료 후 순위표 결국 이날 승리로 5승 고지에 오른 12위(5-8, 세트-5) BLG는 '돌림판도라의 상자'가 준 마지막 선물, 플레이오프의 '희망'을 봤다. 간접적으로 WE 또한 'BLG의 돌림판도라의 상자'의 수혜자가 되며 플레이오프 진출 희망을 이어갔다."
"‘6연승’ 젠지, DRX 잡고 선두 탈환",https://mimgnews.pstatic.net/image/origin/005/2022/07/28/1543011.jpg,https://m.news.naver.com/read.nhn?oid=005&aid=0001543011,https://sports.news.naver.com/news.nhn?oid=005&aid=0001543011,https://n.news.naver.com/sports/esports/article/005/0001543011,국민일보,35,883,2022-07-28T13:21:01,2022-07-28T13:21:01,"젠지가 DRX를 잡고 리그 선두로 복귀했다. 젠지는 28일 서울 종로구 LCK 아레나에서 열린 ‘2022 LoL 챔피언스 코리아(LCK)’ 서머 시즌 정규 리그 2라운드 경기에서 DRX에 2대 0으로 이겼다. 6경기 연속으로 승리 세리머니를 선보인 이들은 12승1패(+22)를 누적해 T1(12승1패 +17)을 제치고 다시 리그 선두가 됐다. 젠지는 두 세트 모두 압도적인 경기력을 과시했다. 라인전에서부터 상대를 눌렀고, 운영 단계에서도 큰 실수 없이 게임을 풀어나갔다. 1세트 땐 제리를 플레이해 승점을 챙겼고, 2세트 땐 반대로 상대에게 제리를 내준 뒤 칼리스타로 응징했다. ‘룰러’ 박재혁이 칼리스타로 좋은 활약을 펼쳐 DRX의 라인전을 마비시켰다. 젠지는 ‘표식’ 홍창현(리 신)에게 한 차례 내셔 남작 버프를 빼앗기기도 했지만, 금세 기력을 회복했다. 이들은 드래곤 둥지로 상대를 유인한 뒤 복수의 킬을 따내 승리를 확정지었다."
"'헤나 VS 테디 맞라인전'…브리온-광동, 선발 라인업 공개 [LCK]",https://mimgnews.pstatic.net/image/origin/311/2022/07/29/1482374.jpg,https://m.news.naver.com/read.nhn?oid=311&aid=0001482374,https://sports.news.naver.com/news.nhn?oid=311&aid=0001482374,https://n.news.naver.com/sports/esports/article/311/0001482374,엑스포츠뉴스,36,869,2022-07-29T06:52:01,2022-07-29T06:52:01,"(엑스포츠뉴스 김수정 기자) 브리온과 광동의 선발 라인업이 공개됐다. 29일 서울 종로구에 위치한 롤파크에서는 '2022 LCK 서머' 2라운드, 프레딧 브리온 대 광동 프릭스의 맞대결이 펼쳐진다. 현재 1승 11패로 3연패를 하고 있는 브리온과 4연패를 달리며 4승 8패를 기록 중인 광동의 만남. 둘 중 1승을 차지하고 연패를 끊을 팀은 어디가 될지 귀추가 주목되는 가운데, 양 팀 모두 최선의 선발 라인업을 준비했다. 먼저, 최근 날카로운 공격력을 보여주고 있는 브리온에서는 '모건' 박기태, '엄티' 엄성현, '라바' 김태훈, '헤나' 박증환, '딜라이트' 유환중이 출전한다. 마찬가지로 한층 물오른 경기력을 선보이고 있는 광동에서는 '기인' 김기인, '엘림' 최엘림, '페이트' 유수혁, '테디' 박진성, '호잇' 류호성이 나선다. 박증환과 박진성 중 원딜 캐리력을 폭발시키며 팀을 승리로 견인할 사람은 누가 될지 기대가 모인다. 사진=엑스포츠뉴스DB"
"자신감 오른 '환이다' 장환 ""젠지·다나와·광동 빼고는 딱히 경계 안돼"" [인터뷰]",https://mimgnews.pstatic.net/image/origin/311/2022/07/29/1482100.jpg,https://m.news.naver.com/read.nhn?oid=311&aid=0001482100,https://sports.news.naver.com/news.nhn?oid=311&aid=0001482100,https://n.news.naver.com/sports/esports/article/311/0001482100,엑스포츠뉴스,37,854,2022-07-28T15:52:01,2022-07-28T15:52:01,"(엑스포츠뉴스 최지영기자) ""2주차에서도 꼭 상위권에 들도록 노력하겠다"" 지난 28일 서울 잠실동에 위치한 비타500 콜로세움에서는 동아시아 지역 통합 e스포츠 대회인 '2022 펍지 위클리 시리즈: 동아시아 페이즈 2(PUBG WEEKLY SERIES: EAST ASIA Phase 2, 이하 PWS 페이즈 2)' 위클리 서바이벌 2주 2일차 경기가 진행됐다. 2주 2일차 서바이벌 결과, ATA가 무서운 기세를 타면서 109점으로 서바이벌 1위를 차지했다. 압도적인 경기력이었다. ATA는 후반을 노리기보다는 교전으로 점수를 대거 획득했다.  '환이다' 장환은 경기 후 진행된 크래프톤 공동 인터뷰에서 ATA의 올라온 기세를 털어놨다. 그는 ""우수한 성적이라기 보다는 우리가 1위까지 하는 과정에서 안 좋은 부분들도 있었다. 그 걸 보완해서 파이널에 임하겠다""고 1위 소감을 전했다. 그는 좀 더 보완할 점으로 ""우리 팀이 개개인의 피지컬은 좋지만 상황 판단력이나 그 상황을 어떻게 풀어가는 순발력 등을 키워야겠다""며 ""팀원들이 다 잘해서 1위를 달성했지만 그런 부분을 보완하면 더 잘하는 팀이 될 것 같다""고 강조했다.  2주차 서바이벌 기간 동안 3번의 치킨을 차지한 ATA. 장환은 ""확실히 치킨으로 가는 과정에서 1주차보다 합이 더 맞았다. 점차 더 발전해나갔다""며 올라온 분위기를 전했다. 장환은 다가올 파이널 구도에 대해 ""여러 팀이 바꼈는데 내가 생각했을 때 게임 하는데는 큰 영향은 없다.그랜드 파이널 진출은 누적 포인트제라 우리가 할 수 있는 최선을 다해 누적 포인트 1위를 노리겠다""고 설명했다. 젠지, 다나와, 광동을 제일 경계한다는 장환. ""세 팀을 제외하면 딱히 경계가 되지 않는다. 광동이 지금 부진하지만 분위기만 바뀐다면 충분히 저력있다""고 밝혔다. 그는 ATA의 교전 능력에 대해 ""오프라인 경기가 오랜만이라 선수들이 많이 떨거라고 생각했다. 그걸 이용해 교전으로 풀었다""며 자신감을 드러냈다. 아울러 장환은 2주차 파이널 각오로 ""1주차 파이널을 잘했다고 자만하지 않겠다. 우리가 실수했던 부분을 보완해서 2주차에서도 꼭 상위권에 들도록 노력하겠다""고 다짐했다.  사진=엑스포츠뉴스DB"
"KeSPA 심판위, ‘버그 대응 문제’ 한화생명-T1전 심판 징계",https://mimgnews.pstatic.net/image/origin/236/2022/07/29/226113.jpg,https://m.news.naver.com/read.nhn?oid=236&aid=0000226113,https://sports.news.naver.com/news.nhn?oid=236&aid=0000226113,https://n.news.naver.com/sports/esports/article/236/0000226113,포모스,38,830,2022-07-29T08:11:01,2022-07-29T08:11:01,"지난 13일의 한화생명 대 T1 경기서 발생한 심판의 운영 미숙에 대해 한국 e스포츠 협회(이하 KeSPA)가 징계 처분을 내렸다. KeSPA는 29일 공식 소셜 네트워크 채널 등을 통해 최근 개최한 심판위원회 대한 결과를 발표했다. 해당 LCK 심판은 LCK 서머 정규시즌 1라운드의 한화생명e스포츠 대 T1의 3세트 경기 도중 발생한 강타 버그와 관련해 버그 발생 직후가 아닌 경기가 이어진 상황서 크로노 브레이크가 적용되게 했으며, 이 과정에서 T1 선수들에게 충분한 정보를 전달하지 않았다. 이와 관련해 심판위원회에서는 LCK 사무국의 경위서, 해당 심판의 경위서, 사건 당시 상황 등을 종합적으로 검토했으며 그 결과 해당 심판의 행위는 커뮤니케이션 과정에서 발생한 경기 운영 미숙 행위로 판단했다. 이에 심판 규정 제14조 ‘심판원의 상벌’에 의거해 ‘T1전 5경기의 배정금지’를 결정했으며, 구체적 징계 수위는 오심이 아닌 경기 운영 미숙인 점, 위원회 개최 전 T1 사무국이 심판 징계 철회를 요청한 점을 함께 고려했다고 알렸다. 이어 경기 배정금지는 심판 역량 평가에 영향을 미치는 견책 이상의 징계이며, 향후 운영 미숙 행위가 누적될 경우, 심판위원회 규정 제6장[심판의 상벌] 제24조에 의거하여 심판의 자격을 강등 혹은 박탈할 수 있다는 점도 강조했다. 안내문을 마무리하며 심판위원회 측은 “연이어 발생한 LCK 심판진 관련 이슈에 대해 매우 무겁게 생각하고 있으며, 리그 및 팀과 선수, 팬들에게 불편함을 드리게 되어 진심으로 사과 말씀 드린다.”며 앞“으로 원활한 리그 진행을 위해 LCK 심판 역량 강화 방안 및 운영 관련 개선책을 빠르게 마련하겠다.”고 약속했다."
"'서머의 왕' kt, 장기전 끝 담원 기아 격파…'8승 달성' [LCK]",https://mimgnews.pstatic.net/image/origin/311/2022/07/29/1482527.jpg,https://m.news.naver.com/read.nhn?oid=311&aid=0001482527,https://sports.news.naver.com/news.nhn?oid=311&aid=0001482527,https://n.news.naver.com/sports/esports/article/311/0001482527,엑스포츠뉴스,39,820,2022-07-29T13:56:01,2022-07-29T13:56:01,"(엑스포츠뉴스 김수정 기자) kt가 스윕승을 거뒀다. 29일 서울 종로구에 위치한 롤파크에서는 '2022 LCK 서머' 2라운드, 담원 기아 대 kt 롤스터의 경기가 치러졌다. 이날 담원 기아에서는 '너구리' 장하권, '캐니언' 김건부, '쇼메이커' 허수, '덕담' 서대길, '켈린' 김형규가 나왔고, kt에서는 '라스칼' 김광희, '커즈' 문우찬, '빅라' 이대광, '에이밍' 김하람, '라이프' 김정민이 출전했다. 2세트에서 담원 기아는 세주아니, 트런들, 라이즈, 루시안, 나미를 선택했고, kt는 오른, 비에고, 아리, 아펠리오스, 룰루를 픽했다. 첫 킬은 탑에서 나왔다. '커즈'는 '너구리'가 점멸이 없다는 점을 노려 탑 갱킹을 시도했고, '라스칼'과 완벽한 호흡을 자랑하며 '너구리'를 잡아냈다. 이후 kt는 5인 바텀 다이브를 시도했고, 깔끔하게 성공시키며 '덕담'과 '켈린'을 쓰러뜨렸다. 전령은 '캐니언'이 가져갔고, 첫 번째 드래곤인 화염용은 '커즈'가 처치했다. 담원 기아 역시 5인 바텀 갱킹을 시도했지만 '라이프'를 잡는 데 그쳤고, kt가 빠르게 합류하면서 되레 '쇼메이커'를 제외한 모두가 잡히고 말았다. 담원 기아는 전령을 활용해 탑 1차 포탑을 밀어냈다. '라스칼'이 다시 한번 바텀으로 향한 사이, 담원 기아는 혼자 있던 '커즈'를 자르는 데 성공했다. 탑에서는 '너구리'가 2차 포탑을 철거했고, 바텀에서는 '에이밍'이 1차 포탑을 밀어냈다. 이어 미드로 올라간 담원 기아는 미드 1차 포탑까지 파괴하며 kt의 상승세를 막았다. '에이밍'이 탑 1차 포탑을 밀어낸 가운데, '덕담'은 미드에서 '빅라'를 노렸지만 뒤이어 합류한 '커즈'에게 역공을 당하며 '켈린'과 함께 죽게 됐다. 담원 기아는 바텀에 혼자 있는 '빅라'를 잡으려 했지만, kt가 다시 한번 빠르게 합류하면서 담원 기아를 잡아먹었다. 두 번째 드래곤인 바람용은 담원 기아가 가지고 있는 상황, kt는 여유롭게 세 번쨰 드래곤인 마법공학 용을 섭취했다. 네 번째 드래곤인 마법공학 용을 kt가 가져간 직후 5:5 한타가 열렸다. '커즈'를 먼저 잘라낸 담원 기아는 kt를 끝까지 쫓아가 '에이밍'까지 잡아내는 데 성공했다. 다섯 번째 드래곤인 마법공학 용과 영혼을 내준 담원 기아는 바론으로 시선을 돌려 버프를 획득했다. 이어 바론 버프를 활용해 미드 2차 포탑을 밀어냈지만, 그 과정에서 '너구리'가 쓰러졌다. 장로 드래곤이 등장하고 긴장감 넘치는 대치를 이어가던 두 팀. 승자는 담원 기아였다. 장로 드래곤을 처치한 담원 기아는 '라스칼'과 '커즈'를 잡아낸 후 미드 억제기를 파괴하고 바론 버프를 둘렀다. 두 번째 장로 용이 나오고, 다시 한번 대규모 한타가 열렸다. 강타 싸움에서 승리한 kt는 한타에서도 대승을 거두고 그대로 넥서스를 파괴했다. 사진=엑스포츠뉴스DB"
"[LCK 톡톡] 광동의 넥서스 ‘테디’ 박진성, “징크스 보다 아펠리오스”",https://mimgnews.pstatic.net/image/origin/109/2022/07/29/4668266.jpg,https://m.news.naver.com/read.nhn?oid=109&aid=0004668266,https://sports.news.naver.com/news.nhn?oid=109&aid=0004668266,https://n.news.naver.com/sports/esports/article/109/0004668266,OSEN,40,808,2022-07-29T13:13:04,2022-07-29T13:13:04,"[OSEN=종로, 고용준 기자] “골드 차이가 많이 났지만, ‘할 만 하다’고 생각했다.” 소환사 협곡 최후의 보루 ‘넥서스’을 차용한 광동의 넥서스라는 애칭의 소유자답게 ‘테디’ 박진성은 상대가 바론 버프를 네 번이나 연속으로 취한 암울한 상황에서 흔들리지 않았다. 광동은 29일 오후 서울 종로 롤파크 LCK아레나에서 열린 ‘2022 LOL 챔피언스 코리아(이하 LCK)’ 서머 브리온과 2라운드 경기서 1세트 패배 2, 3세트를 잡아내면서 2-1로 승리했다. ‘테디’ 박진성과 ‘기인’ 김기인이 공수를 책임지면서 벼랑 끝으로 몰렸던 팀을 구원했다. 이로써 광동은 시즌 5승(8패 득실 -9)째를 올리면서 중위권 진입의 가능성을 살렸다. 이날 단독 POG로 방송 인터뷰에 나선 박진성은 “2세트 역전극을 만들고, 3세트는 나름 괜찮은 경기력이라 좋은 것 같다”고 웃는 얼굴로 승리를 기뻐했다. 1세트 패배와 패색이 짙었던 2세트 피드백에 대한 질문에 그는 “우리가 1, 2세트 찍을 수 있는 조합을 꾸렸음에도 상대를 누르지 못해 피드백을 하면서 나아지려고 했다. 포지셔닝에 대한 이야기를 많이 했다. 먼저 자리를 잡고도, 상대에게 이득을 줬던 점들에 대해 재확인했다”고 답했다. 2세트 브리온이 4 드래곤에, 연속 네 번의 내셔남작 사냥으로 글로벌 골드 격차가 1만까지 벌어졌던 상황에서 그는 승부를 포기 하지 않았다. “골드 차이가 많이 났지만. 원딜이 잘 컸고, 탈리야도 성장이 잘 된 상황이라 한타는 할 만 하다고 생각했다.” 2, 3세트 징크스를 잡았던 박진성은 아펠리오스와 대치 구도를 묻자 의외로 아펠리오스를 선호한다는 의견을 밝혔다. “팀의 해주는 역할에 따라 아펠이 좋을수도,  징크스가 좋을 수도 있다. 두 구도를 한다면 아펠리오스를 하고 싶다. 스타일리쉬하다. 징크스는 팀이 해줘야 하는 점이 있다. 아펠이 조금 더 재미있다.” 광동의 다음 상대는 한화생명. 박진성은 “남은 경기 최대한 많이 이겨서 잘해보겠다”는 다짐으로 인터뷰를 매듭지었다. / scrapper@osen.co.kr"
[LCK 서머] 바론 독식해도 뒤집어지는 경기... 광동 2세트 역전승,https://mimgnews.pstatic.net/image/origin/442/2022/07/29/152203.jpg,https://m.news.naver.com/read.nhn?oid=442&aid=0000152203,https://sports.news.naver.com/news.nhn?oid=442&aid=0000152203,https://n.news.naver.com/sports/esports/article/442/0000152203,인벤,41,799,2022-07-29T09:54:27,2022-07-29T09:53:01,"광동 프릭스가 프레딧 브리온에게 모든 바론을 내주고도 전투 한방으로 역전승을 거뒀다. 2세트에서 프레딧 브리온은 2킬과 함께 출발했다. 인베이드 교전에서 '라바' 김태훈의 갈리오가 도발로 '모건' 박기태의 그웬에게 2킬을 선물했다.  이후, 양 팀의 미드-정글이 봇 라인전에 신경쓰는 양상이 나왔다. 첫 득점은 '라바'가 만들어냈지만, 광동 역시 미드-정글을 봇 라인에 대기하면서 2킬을 기록할 수 있었다. 해당 교전으로 킬 스코어는 4:3으로 광동이 앞서 가게 됐다. 광동은 협곡의 전령은 내줬지만, 봇 라인을 중심으로 스노우 볼을 잘 굴렸다. '테디' 박진성의 징크스가 먼저 포탑을 밀어내면서 급격히 성장할 수 있었다. 미드로 올라온 '테디'는 킬까지 챙기면서 경기를 장악하는 것처럼 보였다. 세 번째 드래곤 전투에서는 브리온이 한타 대승을 거뒀다. 드래곤에 집중하는 사이에 '딜라이트' 유환중의 라칸이 파고들어 아군이 호응할 구도를 만들어줬다. '라바' 김태훈의 갈리오가 궁극기로 호응하면서 에이스를 띄우는 성과를 낼 수 있었다. 바론 버프를 두른 브리온은 포탑을 밀어내면서 글로벌 골드 격차를 더 벌렸다. 다음 바론 버프까지 브리온이 가져가면서 브리온은 속도를 높일 수 있었다. 브리온이 부족한 드래곤 스택은 '엄티'가 책임졌다. 드래곤-바론이 나온 타이밍에 '기인'의 나르를 걷어차 끊어내는 성과를 만들어냈다. 세 번째 바론 버프로 브리온은 두 개의 억제기를 밀어냈다. 하지만 경기는 네 번째 바론 한타 한번으로 결정났다. 이번에도 '딜라이트'의 라칸이 먼저 교전을 열었으나 바론 버스트 중인 아군의 호응이 없었다. 광동은 이 기회를 놓치지 않고 '테디' 징크스로 각개격파하면서 극적으로 역전승을 만들어냈다."
"서열정리 예고한 '구마유시' 이민형 ""한 명, 처리 완료…다음은 룰러"" [인터뷰]",https://mimgnews.pstatic.net/image/origin/311/2022/07/28/1481817.jpg,https://m.news.naver.com/read.nhn?oid=311&aid=0001481817,https://sports.news.naver.com/news.nhn?oid=311&aid=0001481817,https://n.news.naver.com/sports/esports/article/311/0001481817,엑스포츠뉴스,42,761,2022-07-28T05:48:01,2022-07-28T05:48:01,"(엑스포츠뉴스 최지영기자) ""젠지전, 누가 더 위인지 보여주겠다"" 지난 27일 서울 종로 롤파크에서는 '2022 LCK 서머' 2라운드 T1 대 KT의 경기가 펼쳐졌다. 이날 T1은 대망의 통신사매치에서 2대 1 승리를 거두며 12승 고지를 달성했다. 최근 기세가 좋은 KT를 상대로 한 점 돌파를 시도하며 분위기를 반전시켰다. 특히 KT전에서 펜타킬이 나왔다. 그 주인공은 '구마유시' 이민형. 그는 제리로 짜릿한 하드캐리를 보여주며 팀을 이끌었다. 그는 경기 후 진행된 엑스포츠뉴스와의 인터뷰에서 ""우선 한 명, 서열정리를 완료했다""며 자신감 넘치는 소감을 전했다. 그는 8연승의 원동력에 대해 ""하던대로 열심히 하는 게 원동력이다. 매경기 최선을 다하고 있다""고 털어놨다. 이민형은 젠지전 2대 0 승리를 강조했다. 그는 ""다음 경기에서도 누가 더 위인지 보여주겠다. 젠지전은 2대0으로 이기겠다""고 다짐했다. 다음은 '구마유시' 이민형의 인터뷰 전문이다.  > 통신사 매치를 승리했다. 승리소감은? 펜타킬해서 기쁘다. 우선 한 명, 서열정리를 완료했다. 처리 완료.  > 다시 8연승을 쌓았다. 8연승의 원동력은 무엇인가? 우리 하던대로 열심히 하는 게 원동력이다. 매경기 최선을 다하고 있다.  > 에이밍과의 맞대결이 화제였다. 만나보니 어땠나? (나를) 보여줬다고 생각한다. 그리고 다음 경기 젠지전을 잘 준비해야겠다는 느낌이 들었다. > 1세트 유미 선픽과 시비르를 골랐는데 픽 조합을 설명해준다면? 아무래도 원딜 밸류가 높은 픽이 등장하다보니 시너지를 극대화해줄 픽이 유미였다. 시비르가 좋아졌다고 생각하지만 카운터가 있기 때문에 상황보고 픽해야한다.  > 1세트 오랜만에 원딜캐리를 보여준 느낌은? 만족하나? 오랜만에 좋았다. POG를 못 받은게 아쉽다. 오랜만에 재밌는 경기를 했고 나는 원래 원딜 캐리전은 자신 있었다.  > 2세트 유리했던 경기가 순식간에 뒤집혔다. 패배 원인은 무엇으로 봤나? 아무래도 블루 쪽에서 일어난 싸움에서 패배한 뒤 바론을 내준 게 컸다. 제리-유미 쪽이 아펠-쓰레쉬보다 후반에 좋다. 그래서 살짝 힘들었다.  > 3세트 펜타킬을 달성했다. 짜릿했을 것 같은데  상대가 오리아나 궁 빠진 거 보고 무리하게 진입했다. 운이 좋게 펜타킬을 한 것 같고 팀원들이 모두 펜타킬을 주려고 했다. 팀원들의 기뻐하는 모습에 감동받았다. 펜타킬은 원래 주는게 매너다. 팀원들이 양보할 줄 알았다.  > KT와의 경기 몇 점 주고 싶나? 98점 주겠다. 더 잘할 수 있는 여지를 남겨두겠다.  > 다음 경기가 대망의 젠지전이다. 먼저 각오는? 한명 처리했으니까 다음 경기에서도 누가 더 위인지 보여주겠다. 젠지전은 2대0으로 이기겠다.  > 1위로 치고나갈수 있는 기회인데 계속 엎치락 뒤치락 하는게 마음에 안 든다. 서열정리로 젠지를 이겨서 1위를 굳히겠다.  > 젠지에서 가장 핵심이 될 라인은 어디인가? 패치가 이어질테니 KT전 같은 밴픽이 비슷하게 나올 것 같다. 그래서 원딜이 제일 중요하다.  > 마지막으로 하고 싶은 말 KT전 이겨서 참 좋다. 펜타킬도 하고 POG도 받아 기쁘다. 다음경기도 잘하겠다.  사진=엑스포츠뉴스DB"
