title,thumbnail,linkUrl,pcLinkUrl,mobileLinkUrl,officeName,rank,hitCount,updatedAt,createdAt,content
"[LPL] '엔젤 솔로킬' 유칼, 나이트 꺾고 P.O 노린다",https://mimgnews.pstatic.net/image/origin/445/2022/07/29/62646.jpg,https://m.news.naver.com/read.nhn?oid=445&aid=0000062646,https://sports.news.naver.com/news.nhn?oid=445&aid=0000062646,https://n.news.naver.com/sports/esports/article/445/0000062646,MHN스포츠,15,4521,2022-07-29T07:31:01,2022-07-29T07:31:01,"사진=TT 공식 웨이보 (MHN스포츠 이솔 기자) 제목만 보면 말도 안되는 일일지도 모른다. 그러나 더 이상 장난이 아니다. 29일 오후 6시, 유칼 그리고 호야와 함께 하는 TT가 3년 전 시노드래곤 시절 이후 사상 처음으로 플레이오프 진출에 도전한다. 사진=LPL(영문) 공식 웨이보, 엔젤을 솔로킬하는 유칼(2022 LPL TT-WBG 2SET) 1경기에서는 나이트(TES)와 유칼(TT)이 마주한다. 나이트는 현재 루키보다도 좋은 모습을 보이고 있다. 정글러 티안, 원거리 딜러 재키러브 등 뛰어난 실력을 가진 선수들과의 호홉도 좋다. 다만 유칼 또한 이에 못지 않다. 유칼은 최근 3경기에서 최소 한 세트만큼은 MVP에 선정되는 활약을 펼치고 있다. 특히 '초패왕' 더샤이와의 결전에서도 자신을 얕잡아 본 상대 엔젤(세라핀)을 솔로킬하는 등 말 그대로 참교육한 바 있다. 그럴 일은 거의 없지만, 하위권 팀이라는 편견에 사로잡혀 나이트가 방심하는 경우 '나이트 참교육'도 꿈이 아니다. TT의 강점은 교전 집중력이다. 교전이 끝난 것 같은 상황에서도 단 한순간도 방심하지 않고 빈틈을 노린다. TES의 약점은 재키러브라고밖에 할 수 없다. 재키러브는 자신의 손을 믿는 과감한 포지셔닝으로 지난 OMG전 1세트에서 1차 타워 앞에서 그랩을 허용, 패배의 원흉이 됐다. 아직까지 iG시절을 잊지 못하며 리스크&리턴을 노린 재키러브의 플레이를 낚아챈다면, TT의 승리 또한 꿈이 아닐 수도 있다. 사진=WBG 공식 웨이보, 온과 더샤이, 자 따라 해봐 '유미'... '노틸러스(1승 4패)' 2경기에서는 유칼에게 혼날 뻔 했던 웨이보 게이밍이 라오간디 게이밍(LGD)과의 경기로 쉬어간다. 1위 팀을 꺾은 WBG, '이세계' 1위 팀을 꺾은 LGD의 맞대결인 만큼, 현격한 격차 가운데서 벌어질 이번 경기에서는 웨이보 게이밍의 시험적인 챔피언 선택, 전술, 그리고 캐리 롤 선택(서폿-미드)이 등장할 것으로 보인다. 특히 엔젤이 오늘 경기를 앞두고 솔로랭크에서 아리를 7게임 중 4게임(지난 1일 도합)에서 활용한 만큼, 아리의 등장 가능성이 그 어느때보다도 높은 상황이다. 이러한 '쉬어 가는 경기'에서는 대부분의 강팀들이 1옵션보다는 다른 선수들의 폼 회복 및 플레이오프 대비를 위해 몰아주기 전술을 펼치는 경향이 있는 만큼, 이번 경기에서는 더샤이보다는 다른 선수들의 활약이 중요할 것으로 보인다."
"[LCS] TSM, 슬롯 매각 또는 리그 이전 ‘가능성’ 검토해",https://mimgnews.pstatic.net/image/origin/236/2022/07/29/226075.jpg,https://m.news.naver.com/read.nhn?oid=236&aid=0000226075,https://sports.news.naver.com/news.nhn?oid=236&aid=0000226075,https://n.news.naver.com/sports/esports/article/236/0000226075,포모스,16,4507,2022-07-29T01:41:01,2022-07-29T01:06:01,"북미의 터주대감 중 하나인 TSM이 LCS를 떠나거나 다른 리그로 옮기는 모습을 볼 수 있을까? 최근 다수의 해외 매체들은 TSM이 현재 참가 중인 북미 지역 리그 오브 레전드(이하 LoL) 최상위 리그인 LoL 챔피언십 시리즈(이하 LCS) 팀의 슬롯을 판매하는 것을 고려했으며 다른 지역으로의 이동에 대해서도 관심을 보였다고 보도했다. TSM의 첫 번째 고민은 LoL 팀을 위한 선수들의 영입에 열을 올리며 많은 금액을 지출했으나 그 만큼의 성적을 거두지 못하고 있는 현재 상황이다. 2021 시즌 TSM은 롤드컵 진출에 실패했으며 2021 시즌도 서머 스플릿 5주차가 끝난 현재 TSM은 3승 8패의 성적으로 이모탈스와 함께 공동 8위에 올라있다. 또한 북미지역 내에서의 ‘LoL’ 게임의 인기가 예전만 못하다는 점도 이러한 고민에 한 몫을 하고 있는 것으로 알려졌다. 최근 e스포츠 차트의 발표에 따르면 LCS의 스프링 스플릿 최대 시청자 수는 387,000, 평균 시청자 수는 123,411명을 기록한 데 비해 라이벌 리그인 유럽의 LEC는 최대 시청자 수 723,000 명, 평균 시청자 수는 270,749 명을 기록한 것으로 나타났다. 이와 함께 너무 많은 종목에 참여한 상황서 비용이 급증하며 감축의 필요성도 제기되고 있다. 익명의 한 소식통은 이들에게 “e스포츠 전반에 대한 비용을 삭감하고 있으며, 다른 e스포츠 부문의 조직을 판매할 수도 있다.”고 이야기한 것으로 알려졌다. 이러한 다양한 위기 속 TSM이 타개책으로 한 때 LCS 팀 슬롯의 판매 또는 LEC으로의 이전을 고려했다는 것이 이들의 주장이다. 특히 LEC로의 이적에 대해서는 미스피츠 게이밍이 LEC 슬롯을 판매하는 단계에서 TSM이 금액 등 몇 가지 문의를 했다고 보도 매체들에 알렸다. 그러나 또 다른 소식통은 이러한 TSM의 움직임이 정말로 LCS를 이탈하거나 LEC로 팀을 옮기려는 것 보다는 재정적인 안정을 위해 어떤 것을 선택할 수 있을지에 대해 조사하는 과정에서 나온 ‘아이디어’ 중 일부였다고 주장하고 있다."
[LCK] 과감한 플레이 강조한 ‘비디디’ “대회에서 소극적으로 변해”,https://mimgnews.pstatic.net/image/origin/236/2022/07/29/226076.jpg,https://m.news.naver.com/read.nhn?oid=236&aid=0000226076,https://sports.news.naver.com/news.nhn?oid=236&aid=0000226076,https://n.news.naver.com/sports/esports/article/236/0000226076,포모스,17,2964,2022-07-29T01:45:01,2022-07-29T01:45:01,"“연습에서는 과감한 플레이를 하지만 대회에서는 소극적으로 변했다. 오늘은 최대한 과감하게 플레이하려고 했다” 28일, 농심이 리브 샌박을 꺾고 8연패의 마침표를 찍었다. 경기 후 기자실을 찾은 ‘비디디’ 곽보성이 승리의 기쁨을 나눴다. 승리 소감으로 곽보성은 “중위권 팀을 잡으면서 8연패를 끊어 기분 좋다”며 연패를 끊은 현 상황이 기쁘다는 마음을 감추지 않았다. 곽보성은 승리와 더불어 이날 경기에서 원하던 플레이를 펼친 것 같아 만족스럽다는 입장을 전했다. 그는 “연습에서는 과감한 플레이를 하지만 대회에서는 소극적으로 변했다. 오늘 대회에서는 최대한 과감하게 플레이하려고 했다”며 과감한 플레이를 통해 연패의 돌파구를 찾으려 했다는 입장을 밝혔다. 지난 23일 KT전에서 팀은 패배했지만 곽보성은 라이즈를 통해 자신의 첫 펜타킬을 기록하기도 했다. 그는 “솔로 랭크에서는 (펜타킬을) 많이 해봤지만 대회에서는 처음이라 너무 좋았다. 펜타킬 후에는 다음 경기는 이길 것 같다고 생각했다”며 자신의 슈퍼플레이와 함께 자신감도 회복할 수 있었다고 이야기했다. 리브 샌박전에서 승리하며 플레이오프 진출의 가능성도 여전히 남아있게 됐다. 곽보성은 “가능성은 희박하다. 하지만 남은 경기에서 상대에게 아무것도 하지 못하고 지는 모습보다는 할 수 있는 것들을 최대한 하는 모습을 보여드릴 수 있도록 노력하겠다”며 남은 경기에서 좋은 모습을 보이고 싶다는 각오를 팬들에게 알렸다. 마지막으로 그는 “끝까지 응원해주신 팬들에게 감사하다”고 말하며 자신들에게 끝없는 지지를 보내주는 팬들에게 감사한 마음을 전하며 인터뷰를 마쳤다."
"[오!쎈 인터뷰] 통산 800전 꿈꾸는 ‘피넛’ 한왕호, “프로는 성공하려면 포기할 줄도 알아야”",https://mimgnews.pstatic.net/image/origin/109/2022/07/28/4667040.jpg,https://m.news.naver.com/read.nhn?oid=109&aid=0004667040,https://sports.news.naver.com/news.nhn?oid=109&aid=0004667040,https://n.news.naver.com/sports/esports/article/109/0004667040,OSEN,18,2675,2022-07-28T04:58:07,2022-07-28T04:58:07,"[OSEN=종로, 고용준 기자] “500전을 하는 동안 응원해 주신 팬 분들에게 감사드려요.” 역대 일곱 번째 LCK 500전 출전이라는 대기록을 세운 ‘피넛’ 한왕호는 그간의 시간을 견딜 수 있도록 버팀목이 되어준 팬 들에 감사를 잊지 않았다. 2014년 말 프로로 데뷔한 9년차 선수로서 후배들에 대한 조언도 아끼지 않았다. 한왕호는 지난 24일 서울 종로 롤파크 LCK아레나에서 열린 ‘2022 LOL 챔피언스 코리아(이하 LCK)’ 서머 한화생명과 2라운드 경기서 통산 7번째 500전에 나선 선수로 이름을 올렸다. 한왕호의 활약에 힘입어 젠지는 2-0 완승을 거뒀다. 경기 후 OSEN과 만난 한왕호는 “벌써 500전이나 됐다 라는 생각을 해본다. 한편으로 LPL을 다녀오지 않았다면 더 빨랐을 텐데 한편으로는 LPL을 갔다와 늦은게 아니다라는 아쉬움도 든다. 500전을 하는 동안 응원해 주신 팬 분들에게 감사드린다”라고 소감을 전했다. 공교롭게 500전을 찍은 이날 경기 해설 중 한 명이 ‘고릴라’ 강범현. 현역 시절 499전에서 멈춘 강범현의 기록을 뛰어 넘은 감회를 묻자 “공교롭게 범현 형과 바통을 터치한 것 같다. 범현 형의 499전이 아쉽다. 한 경기를 더 했다면 하는 아쉬움이 크다”면서 “나는 800전까지는 채우고 싶다”고 자신의 향후 목표를 밝혔다. 프로게이머로서 데뷔 당시 지금의 차이를 묻자 그는 “처음에는 성격이 강했고 고집스러웠다. 자기주관이 뚜렷한 건 지금도 마찬가지지만 이제는 조금 더 유해진 것 같다. 여러 사람들을 만나면서 경험으로 좋은 영향을 받아온 것 같다”고 답하면서 “후배들에게 포기할 줄 알아야 한다는 말을 해주고 싶다. 스무살 전후의 정말 하고 싶은 많은 나이다. 나 역시 그랬다. 프로게이머로 성공하고 싶다면 많은 걸 포기하면서 살아야 한다. 다 누리기 보다는 포기할 줄도 알아야 성공할 수 있다는 이야기를 해주고 싶다”고 후배들에 대한 프로게이머 직업관에 대한 조언도 전했다. 한왕호는 “다음 상대는 디알엑스하고 T1을 연달아 만난다. 큰 분기점이다. 두 경기 다 잡으면 정규시즌 1위로 마무리할 가능성이 높아진다. 열심히 준비해서 잘 마무리하겠다”면서 “좋은 경기력으로 팬 분들께 인사드리겠다”는 말로 인터뷰를 마무리했다. / scrapper@osen.co.kr"
"“공격적인 플레이, 눈꽃의 주도적 콜 덕분”",https://mimgnews.pstatic.net/image/origin/005/2022/07/28/1543000.jpg,https://m.news.naver.com/read.nhn?oid=005&aid=0001543000,https://sports.news.naver.com/news.nhn?oid=005&aid=0001543000,https://n.news.naver.com/sports/esports/article/005/0001543000,국민일보,19,2459,2022-07-28T11:37:03,2022-07-28T11:37:03,"농심 임혜성 코치 인터뷰 “선수들이 힘든 와중에도 열심히 하고 있어요. 팬들께 죄송하고, 감사합니다.” 농심 레드포스 임혜성 코치가 8연패를 끊은 소감을 밝혔다. 농심은 28일 서울 종로구 LCK 아레나에서 열린 ‘2022 LoL 챔피언스 코리아(LCK)’ 서머 시즌 정규 리그 2라운드 경기에서 리브 샌드박스를 2대 1로 꺾었다. 연패 사슬을 끊은 이들은 뒤늦게 시즌 3승째(10패 -14)를 신고했다. 순위표에선 8위에 머물렀다. 경기 후 국민일보와 만난 임 코치는 “선수단과 마찬가지로 연패 때문에 스트레스를 많이 받았다”고 털어놓으면서 “이겨서 정말 기쁘기도 하고, 시즌 막바지가 돼서야 경기력이 올라온 것 같아 아쉽기도 하다”고 덧붙였다. 임 코치는 연패를 끊은 비결로 ‘팀원 간 턴 맞추기’를 꼽았다. 그는 “굳이 들어갈 필요가 없는 타이밍인데 들어가서 손해를 보곤 했다”면서 “주도권이 있을 때 서로의 턴을 맞추고, 기다렸다 들어가자고 선수들에게 얘기했다”고 전했다. 이어 “선수들이 라인전을 잘해놓고도 턴을 안 지켜서 죽는 경우가 연패하는 동안 너무 많이 나왔다. 기본적인 실수도 잦았다”며 “한타 포지셔닝, 스킬 분배, 바텀 구도 등에 대해 선수들과 많은 이야기를 나눴다”고 전했다. 협곡의 전령에 자원을 과투자했던 점도 보완했다. 임 코치는 “전령 싸움에 대해서도 집중 피드백을 했다”며 “바텀에서 손해를 보면서까지 전령을 먹을 필요는 없다고 했다. 예전부터 고치고자 노력했던 것들인데, 이제서야 좋은 결과가 나오고 있다”고 덧붙였다. 사실 농심은 시즌 초부터 스크림 강팀으로 평가받았다. 임 코치는 연습과 실전 간 괴리의 원인 중 하나로 ‘집중 밴’에 취약했던 점을 들었다. 그는 “스크림 땐 집중 밴이 잘 안 나오기 마련인데, 실전에선 다루기 어려운 챔피언이 많아 구도가 망가지는 경우가 잦았다”며 “챔프 폭을 늘리는 과정이 더뎠다”고 털어놨다. ‘눈꽃’ 노회종의 합류도 큰 힘이 됐다. 임 코치는 “회종이가 바텀에서 주도적으로 콜을 한다”면서 “‘이때 더 세게 해야 했다’ ‘방금 타이밍을 놓쳤다’ 등 코치진이 늘상 하는 얘기지만 코치가 경기 후 말하는 것과 선수가 게임 중 말하는 건 전혀 다르다. 회종이가 의견을 내고, 선수단이 개선하는 양상이 되다 보니 더 공격적인 플레이가 나오는 것 같다”고 전했다. 농심의 다음 상대는 프레딧 브리온이다. 지난 1라운드 대결에선 패배했다. 임 코치는 “프레딧은 아주 정석적인 플레이를 하는 팀인데, 지난 1라운드 땐 앞서 얘기했던 피드백들이 잘 지켜지지 않아서 졌다. 우리가 안 나가주면 상대가 답답해하는 상황인데도 굳이 나갔다가 손해를 보는 등 턴을 안 지켜서 졌다”고 복기했다. 그는 팀의 앞서는 라인전 능력을 활용해 프레딧에 복수하겠다고 전했다. 임 코치는 “프레딧을 보고 소위 방패로 치는 팀이라고들 한다. 우리는 라인전에서부터 주도적으로 플레이할 수 있고, 밸류도 높은 픽을 가져올 계획이다. 상대가 방패를 들든 말든 밸류로 찍어누르겠다”고 각오를 다졌다."
[LCK] T1전 1라운드 패배 이유 알고 있다는 ‘쵸비’ “이번에는 승리 가능”,https://mimgnews.pstatic.net/image/origin/236/2022/07/28/226070.jpg,https://m.news.naver.com/read.nhn?oid=236&aid=0000226070,https://sports.news.naver.com/news.nhn?oid=236&aid=0000226070,https://n.news.naver.com/sports/esports/article/236/0000226070,포모스,20,2166,2022-07-28T13:43:01,2022-07-28T13:43:01,"“T1에게 1라운드 패배 이유를 알고 있다. 잘 준비하면 이번에는 이길 수 있다” 28일, 젠지가 압도적인 경기력을 뽐내며 DRX를 상대로 2대 0 승리를 가져갔다. 2세트 POG에 선정된 ‘쵸비’ 정지훈이 승리의 기쁨을 나눴다. 승리 소감으로 “DRX가 강팀이라고 생각했기 때문에 깔끔하게 이길 수 있어 기분 좋다”고 말한 정지훈. 젠지는 상대에게 탈리야를 주고 이를 맞받아쳤다. 정지훈은 “미드는 상성이 정리되어 있다. 조합 컨셉을 맞출수도 있었기 때문에 어떤 챔피언을 주더라도 상관 없었다”며 상대에게 탈리야를 허용한 이유를 밝혔다. 젠지는 1,2세트 모두 빠르게 DRX를 상대로 승기를 굳혔다. 정지훈은 그 이유로 ‘피넛’ 한왕호를 꼽았다. 그는 “피넛선수가 있기 때문에 가능한 것 같다”며 한왕호의 존재로 인해 팀이 빠르게 승기를 굳힐 수 있다는 사실을 알렸다. 젠지의 다음 상대는 T1이다. 정지훈은 “서머 1라운드는왜 진지 알고 있다. 잘 준비하면 이길 수 있다고 본다”며 T1전 필승을 다짐했다."
[LCK 서머] '쵸비'가 전하는 아리 활용법,https://mimgnews.pstatic.net/image/origin/442/2022/07/29/152153.jpg,https://m.news.naver.com/read.nhn?oid=442&aid=0000152153,https://sports.news.naver.com/news.nhn?oid=442&aid=0000152153,https://n.news.naver.com/sports/esports/article/442/0000152153,인벤,21,2086,2022-07-28T22:43:01,2022-07-28T22:43:01,"28일 펼쳐진 2022 LCK 서머 스플릿 정규 스플릿 32일 차 2경기, 젠지 e스포츠가 파괴적인 경기력으로 갈 길이 바쁜 DRX를 잡고 12승 1패 +22를 기록하며 다시 T1을 상대로 단독 1위 자리를 빼앗았다. 또한, 세트 12연승이라는 대기록을 이어갔다. 이하 젠지 '쵸비' 정지훈의 승리 인터뷰 전문이다. Q. 깔끔한 경기력으로 DRX를 2:0으로 잡은 소감은? 2:0으로 승리하고 6연승에 성공해 기쁘다. Q. 완승의 원인은? 팀원 모두 잘해줬고, 평소에 열심히 하니까 좋은 결과가 나온 것 같다. Q. DRX라는 팀을 어떻게 생각했고, 어떤 점을 주의했나? 요즘 '제카' 선수가 잘하는 것 같아서 신경을 썼다. 미드 라인전에서 내가 생각한 구도를 크게 벗어나지 않아서 쉽게 풀어간 것 같다. Q. 아리를 두 번 사용했는데, 룬이 달랐다. 어떤 이유인가? 1세트, 원래 지배를 선호하는 데 상대에 시비르가 있어서 경기가 길어질 것 같아 보조 룬에 폭풍의 결집, 2세트는 빨리 끝날 것 같아서 지배 룬을 사용하게 됐다. Q. 오늘 경기마다 승부처는? 1세트는 전령을 바텀에 활용하면서 타워를 파괴했을 때, 2세트는 미드에 소환사 주문 교환이 발생했고, 아리-바이 조합을 활용해 상대를 잡았을 때 유리하게 굴릴 수 있었다. Q. 아리 성적이 좋다. 본인의 스타일과 어떤 점이 맞는가? 아리는 진입각을 잘 봐야 한다. 진입해서 위협적일 수 있게 성장을 잘해야 하는데 그런 부분이 잘 맞는다. Q. 밴시의 장막을 활용한 까닭은? 아리는 사이드가 중요한데, 밴시의 장막이 생존력을 올려준다. 그리고 진입할 때 상대의 스킬을 막아주는 것도 좋아서 자주 활용하는 편이다. 나의 플레이 스타일과 잘 맞는다. Q. 다음 경기가 T1이다. 많은 사람들이 기대하는 매치인데. 자신감이라기보다는 그냥 해보는 거다. 물론 충분히 이길 수 있을 것 같다. 지난 경기에서는 평소 플레이가 잘 나오지 않았고, 섬세한 부분에서 피드백이 있었기 때문에 할만하다고 생각한다. Q. T1전을 승리하면 노래 공약을 걸었다. 생각한 선곡은 있나? 내가 부른다는 게 아니고 '도란' 선수에게 추천을 했던 거다(웃음). Q. 끝으로 하고 싶은 말은? 2라운드도 끝을 향해 달려가고 있다. 항상 응원해주는 팬들에게 감사하고, 좋은 경기로 보답하겠다."
"[LCK] 조합 이유 보여주지 못해 아쉬웠던 ‘고스트’ ""지더라도 할 건 해야돼”",https://mimgnews.pstatic.net/image/origin/236/2022/07/29/226085.jpg,https://m.news.naver.com/read.nhn?oid=236&aid=0000226085,https://sports.news.naver.com/news.nhn?oid=236&aid=0000226085,https://n.news.naver.com/sports/esports/article/236/0000226085,포모스,22,1937,2022-07-29T04:31:01,2022-07-29T04:31:01,"""조합의 이유를 보여준 적이 거의 없다. 지더라도 할 건 하고 지고 싶다” 28일, 농심이 리브 샌박을 꺾고 8연패의 마침표를 찍었다. 경기 후 포모스와의 인터뷰에 응한 ‘고스트’ 장용준이 끝까지 자신들을 응원해준 팬들에게 감사한 마음을 전했다. 장용준은 팬들에게 감사한 마음을 가장 먼저 전했다. 그는 “너무 오랜만에 이겨서 기분 좋다. 경기가 끝나고 인사하러 가는데 한 팬분이 울고 계신 것을 봤다. 함께 울컥했다”는 상황을 설명했다. 이어 “경기를 하러 올 때마다 팬분들이 계속 와주셔서 감사드리지만 한편으로는 너무 죄송했다. 형편없는 경기력에도 끝까지 응원해주신 팬들을 보고 끝까지 포기하지 않아야겠다는 생각이 든다”고 이야기하며 노력의 원동력이 팬임을 밝혔다. “이길 수 있었던 경기도 있었고 허무하게 진 경기도 있었다. 게임 내 플레이와 자신감 등 정말 많은 문제들이 복합적으로 있었다”는 연패 이유를 밝힌 장용준. 그는 “싸움도 못하고 진 경기가 많았다. 조합의 이유를 보여준 적이 거의 없는 것 같았기 때문에 지더라도 할 건 하고 지고 싶었다”며 리브 샌박전에서 원하던 플레이를 보여줄 수 있어 만족스럽다는 입장을 전했다. 이어 “모든 경기에 최선을 다해 팬들에게 저희의 방향성을 보여드리기 위해 노력하고 있다”며 앞으로 더욱 확실해질 팀 컬러를 팬들에게 선보일 것임을 다짐했다. 마지막으로 장용준은 “8연패하는 동안 끝까지 응원해준 팬들에게 정말 감사하다. 앞으로 남은 경기도 최선을 다하도록 하겠다”는 감사 인사를 팬들에게 다시 전하며 인터뷰를 마쳤다."
"[LCK] 서머의 kt, 명승부 끝에 담원 기아 격파...서부 조 재입성(종합)",https://mimgnews.pstatic.net/image/origin/347/2022/07/29/165083.jpg,https://m.news.naver.com/read.nhn?oid=347&aid=0000165083,https://sports.news.naver.com/news.nhn?oid=347&aid=0000165083,https://n.news.naver.com/sports/esports/article/347/0000165083,데일리e스포츠,23,1936,2022-07-29T15:52:01,2022-07-29T13:59:01,"kt 롤스터가 명승부 끝에 담원 기아를 꺾고 다시 한번 서부조에 입성했다.  kt는 29일 오후 서울 종로구 그랑서울 롤파크 LCK 아레나에서 열린 2022 LCK 서머 7주 차 담원 기아와의 경기서 2대0으로 승리했다. 승리한 kt는 시즌 8승 6패(+4)를 기록하며 디알엑스(7승 6패)을 제치고 5위로 올라섰다.  반면 담원 기아는 시즌 5패(9승)째를 당했다. 4위 리브 샌드박스(8승 5패)와는 반 게임 차로 좁혀졌다.  kt가 1세트서 골드 7,000 격차를 뒤집으며 승리를 따냈다. 경기 중반까지 담원 기아에게 밀리는 모습을 보인 kt는 경기 23분 탑에서 '라스칼' 김광희의 그웬이 '너구리' 장하권의 오른을 잡았고, 사이드 운영으로 탑 3차 포탑을 밀어냈다.  이어 '라스칼'의 그웬이 순간이동으로 오브젝트 쪽으로 넘어와서 '쇼메이커' 허수의 리산드라를 정리한 kt는 경기 35분 '커즈' 문우찬의 스카너가 바론 스틸에 성공했다.  근처에 있던 담원 기아의 병력을 모두 정리한 kt는 난타전 끝에 경기 46분 본진으로 들어온 담원 기아의 병력을 막았고 상대 본진으로 들어간 그웬과 '빅라' 이대광의 라이즈가 상대 수비하던 병력을 제압하며 1대0으로 앞서 나갔다.   2세트 초반 '커즈'의 비에고가 탑 갱킹 때 '너구리'의 세주아니를 퍼블로 잡은 kt는 경기 8분 바텀 포탑 5인 다이브로 상대 2명을 처치했다. kt는 이어진 바텀 한타서 대승을 거뒀다.  경기 13분 바텀 정글서 '커즈'의 비에고가 죽은 kt는 경기 15분 미드에서 담원 기아의 바텀을 정리했다. 이어진 탑 전투서 '너구리'의 세주아니를 정리한 kt는 바텀에서도 '쇼메이커'의 라이즈와 '켈린' 김형규의 나미를 처치했다.  kt는 경기 25분 드래곤 3스택을 쌓은 뒤 바텀 전투서 피해를 입었지만 탑 레드서 '캐니언'의 트런들을 끊었다. 경기 30분 마법 공학 드래곤 영혼을 가져온 kt는 경기 34분 미드 싸움서 승리했다.  장로 드래곤을 먹은 뒤 본진으로 들어온 담원 기아의 공격을 막은 kt는 경기 44분 '커즈'의 비에고가 장로 드래곤을 스틸한 뒤 근처에 있던 병력을 제압했다. '에이밍'의 아펠리오스가 트리플 킬을 기록한 kt가 담원 기아의 넥서스를 초토화시키며 경기를 매듭지었다."
